text,speaker,talktime_words,math_density,uptake,student_reasoning,focusing_questions,text_arabic,text_back_translated
"I’m glad you asked that question.  Then I’m going to have people.  The same way you did your multiple equation, I’m going to have people kind of decide, what is the division equation, which is just like he said, how many, and then show the division side.  We’ll do one, all right? So, I need your attention. Student V, if you could move up for a minute.  Student V, are you okay?",teacher,72,5,1.0,,0.0,أنا سعيدة أنك طرحت هذا السؤال. ثم سأحصل على الناس. بنفس الطريقة التي قمت بها معادلة متعددة، سأحصل على الناس نوع من القرار، ما هي معادلة التقسيم، وهو بالضبط كما قال، كم عدد، ثم عرض جانب التقسيم. سنقوم بواحدة، حسنا؟ لذلك، أنا بحاجة إلى انتباهك. الطالب V، إذا كنت يمكن أن تتحرك لمدة دقيقة. الطالب V، هل أنت بخير؟,"I'm glad you asked this question. Then I'll get people. In the same way that I did multiple equations, I'll get people some kind of decision, what is the partition equation, which is exactly what he said, how many, then the width of the partition side. We're going to do one, okay? So, I need your attention. Student V, if you can move for a minute. Student V, are you okay?"
I just think about an idea here.  You know the roller coaster?,student,12,0,,0.0,,أنا فقط أفكر في فكرة هنا هل تعرف الساحلة العابرة؟,I'm just thinking of an idea here.
"Ride, roller coaster? Yeah.",teacher,4,0,1.0,,0.0,ركوب السيارات العابرة؟,Riding in passing cars?
"[Speaking in French] build with multiple towers.  [French] fast, would be as slow.",student,13,1,,0.0,,[تحدث الفرنسية] بناء مع أبراج متعددة. [فرنسية] بسرعة، سيكون بطيء.,"[French] building with multiple towers. [French] Fast, it will be slow."
"Wow, that’s physics.",teacher,3,0,1.0,,0.0,هذا هو الفيزياء,That's what physics is all about.
"Yeah, that’s why we were taking the pencil and counting the second.",student,12,0,,0.0,,أجل، لهذا السبب كنا نأخذ القلم ونعد الثانية,"Yeah, that's why we used to take a pencil and count the second."
"Wow, so you’re getting into the physical study, that’s a big science.  So we’ll kind of, we’ll probably get into that later.  Now listen carefully.  Student V, why I wanted you to be here is because I needed your help to tell me which is…",teacher,45,0,0.0,,0.0,حسناً، إذاً أنتِ تدخلين إلى دراسة الفيزياء، هذا علم كبير، لذا سندخل في ذلك نوعاً ما، على الأرجح سندخل في ذلك لاحقاً. الآن استمعي بعناية. الطالب الخامس، لماذا أردتُكِ أن تكوني هنا لأنني احتجتُ لمساعدتكِ لتخبريني ما هو...,"Okay, so you're going to study physics, which is a big science, so we're going to get into that sort of thing, probably later on. Now listen carefully."
I can’t see anything from [inaudible].,student,6,0,,,,لا أستطيع رؤية أي شيء من [غير مسموع].,I can't see anything from [unheard of].
"I need a few that can help me with the division, because I know some people are ready.   Sit down, sit down, sit down, sit, sit, sit.  Sit down, Student K, sit down.  Now quickly, and I have the rest for the other people.  The rest.  Before you move on to your seat and work on it.  Student K.  Could you give to Student K back there please.  Student R, Student R, what’s to do, he’s over.  Student R.  Student I. I have yours.",teacher,84,1,0.0,,0.0,أحتاج إلى عدد قليل من الأشخاص الذين يمكنهم مساعدتي في التقسيم، لأنني أعرف أن بعض الناس مستعدون. اجلس، اجلس، اجلس، اجلس، اجلس، اجلس. اجلس، اجلس، اجلس، اجلس، اجلس، اجلس، اجلس، اجلس، اجلس الآن بسرعة، ولدي الباقي للناس الآخرين. الباقي. قبل أن تنتقل إلى مقعدك وتعمل على ذلك. الطالب K. هل يمكن أن تعطى للطالب K هناك من فضلك. الطالب R، الطالب R، ما يجب القيام به، هو over. الطالب R. الطالب I. لدي لك.,"I need a few people who can help me with the split, because I know some people are ready. Sit, sit, sit, sit, sit, sit. Sit, sit, sit, sit, sit, sit, sit, sit, sit, sit, sit now quickly, and I have the rest for other people. The rest. Before you move to your seat and work on it. Student K. Can you give student K there, please. Student R, student R, ma"
You said to fix this?,student,5,0,,,,قلت أن أصلح هذا؟,Did you say I should fix this?
"No, no, we’ll see. Student J.  Hold on, hold on, we’ll ask you a few questions.  Student K, good job.  Student J, good job.  Student N, good job. Student J, good job.  And give that to Student L, please. Okay, Student K.  We need you back here, and Student R. Hold on, hold on.  Okay.  Now, before you go back to your seat, listen carefully.  I need your attention.  A quick, quick one.  Quick one.  I could see she’s showing it. Student V, I need your attention.  I need you to kind of show people the divisions.  Not the division [story], but a division equation.  And we could call it division.  I know a lot of you already know division is the…",teacher,122,6,1.0,,0.0,لا، لا، سنرى. الطالب J. انتظر، انتظر، سنطرح لك بعض الأسئلة. الطالب K، عمل جيد. الطالب J، عمل جيد. الطالب N، عمل جيد. الطالب J، عمل جيد. و أعط ذلك للطالب L، من فضلك. حسنا، الطالب K. نحتاجك هنا، والطالب R. انتظر، انتظر. حسنا. الآن، قبل أن تعود إلى مقعدك، الاستماع بعناية. أنا بحاجة إلى انتباهك. واحدة سريعة، سريعة. واحدة سريعة. أستطيع أن أرى أنها تظهر ذلك. الطالب V، أنا بحاجة إلى انتباهك. أريد منك أن تظهر للناس التقسيمات. ليس التقسيم [القصة] ، ولكن معادلة. ويمكننا أن نسميها التقسيم. وأنا أعلم أن الكثير منكم يعرف بالفعل التقسيم هو...,"No, no, we'll see. Student J. Wait, wait, we'll ask you some questions. Student K, good work. Student J, good work. Student N, good work. Student J, good work. And give it to student L, please."
Opposite of multiplication.,student,3,1,,,,العكس من مضاعفة,The opposite of doubling is true.
"Thank you.  Now, if you wrote your equation, your equation was…",teacher,11,2,,,0.0,الآن، إذا كتبت معادلتك، معادلتك كانت...,"Now, if I wrote your equation, your equation would be..."
[Inaudible],student,1,0,,,,[غير مسموع],[Unheard of]
"Student M, we need your attention for a minute.  One minute and then I’ll let you work.  Listen, listen, everyone.  I need you to look at what we are doing.  Student J.  Yes.",teacher,33,0,,,0.0,الطالب (إم) ، نحتاج إلى إنتباهك لدقيقة، دقيقة واحدة، ثم سأتركك تعمل، اسمعوا، اسمعوا جميعاً، أريدكم أن تنظروا إلى ما نفعله. الطالب (ج) نعم.,"Student (M), we need your attention for a minute, a minute, and then I'll let you work, listen, listen, all of you, I want you to look at what we're doing. Student (C) Yes."
704.,student,1,0,,,,704,704  704
704.,teacher,1,0,,,0.0,704,704  704
Divided by 16.,student,3,1,,,,مقسومة على 16,Divided into 16
"Divided by 16.  Now, how do you get to do this equation? What was your time? What was your multiple equation?",teacher,21,4,,,1.0,الآن، كيف يمكنك القيام بهذه المعادلة؟ ما هو وقتك؟ ما هو المعادلة المتعددة؟,"Now, how can you do this equation? What is your time? What is the multiple equation?"
My multiple equation was 44 times 16.,student,7,2,,,,معادلتي المتعددة كانت 44 × 16.,My polynomial equation was 44 × 16.
44.  Sorry.  I need your attention so you can help me.  44 times 16.,teacher,14,0,1.0,,0.0,المعذرة أحتاج انتباهك حتى تتمكن من مساعدتي,"I'm sorry, I need your attention so you can help me."
Equals 704.,student,2,0,,,,يساوي 704.,is equal to 704.
Equals 704. And remember we said when we’re doing our – and we call this factor… Some people are not paying attention.  Factor…,teacher,23,0,,,0.0,يساوي 704 وتذكر أننا قلنا عندما نقوم بعمل  و نسمي هذا العامل... بعض الناس لا ينتبهون.,It's equal to 704 and remember that when we do a task and call this factor... some people don't pay attention.
Factor times factor equals product.,multiple students,5,1,,,,العوامل × العوامل = المنتج,Factors × factors = product
"Product.  Now, for our division, what do we do?",teacher,9,2,1.0,,0.0,المنتج، الآن، بالنسبة لقسمنا، ماذا نفعل؟,"Product, now, for our department, what do we do?"
"Mr. J., I know a way to do it, [inaudible] 16.",student,11,0,,0.0,,سيد جي، أنا أعرف طريقة للقيام بذلك، [غير مسموع] 16.,"Mr. J, I know a way to do this, [unheard of] 16."
"Yes, but this is our…  I’ll come to you for a minute.  Then we did the factor …",teacher,18,0,0.0,,0.0,أجل، لكن هذا هو... سأأتي إليك لدقيقة، ثم فعلنا العامل...,"Yeah, but that's it... I'll come to you for a minute, and then we do the worker thing..."
You mean the product.,student,4,1,,,,تعني المنتج,Means the product
"We did the product, I’m sorry, product for our division.  And then we look for how many, look up here, how many, how many, this is how many…",teacher,28,3,,,0.0,لقد صنعنا المنتج، أنا آسف، المنتج لقسمنا ثم نبحث عن عدد، نبحث هنا، كم عدد، كم عدد، هذا عدد...,"We made the product, I'm sorry, the product of our division and then we look for a number, we look here, how many, how many, how many, this number..."
Groups.,student,1,0,,,,المجموعات.,The groups.
"How many groups of 16.  Thank you very much.  How many groups. Now we’re going to build it into how many groups of 32? This is our prediction.  We did for 16, now the next one would be 32.   We don’t need to tell, yes, because people have different numbers, and I want people to kind of work it up.  Build the tower up to, not to 16 now, but to 32. But you can predict.  How could you predict that? See, Student R is not really paying attention.  I don’t think he’ll be able to do a good job.  Student R.  Could you help us.  How could you predict.  If I know for 16…",teacher,115,0,,,1.0,كم عدد المجموعات من 16؟ شكراً جزيلاً لكم. كم عدد المجموعات. الآن سنقوم بإنشائها إلى عدد المجموعات من 32؟ هذا هو التنبؤ لدينا. فعلنا لـ 16، والآن المجموعة التالية ستكون 32. نحن لا نحتاج أن نقول، نعم، لأن الناس لديهم أرقام مختلفة، وأريد أن الناس نوعاً ما يعملون على ذلك. بناء البرج إلى، وليس إلى 16 الآن، ولكن إلى 32. ولكن يمكنك التنبؤ. كيف يمكنك التنبؤ بذلك؟ انظر، الطالب R لا يجهل الانتباه حقاً. لا أعتقد أنه سيكون قادراً على القيام بعمل جيد. الطالب R. هل يمكنك مساعدتنا. كيف يمكنك التنبؤ. إذا كنت أعرف لـ 16 ...,"How many sets of 16? Thank you very much. How many sets. Now we're going to build it up to the number of sets of 32? That's our prediction. We did 16 and now the next set will be 32. We don't need to say, yes, because people have different numbers, and I want people to sort of work on that. building the tower to, not to 16, but to 32, but you can predict."
Yes?,student,1,0,,,,-أجل؟,- Yes?
"He’s good now, listen to Student R. If I know for 16 multiple, this is my product.",teacher,17,2,,,0.0,هو جيد الآن، استمع إلى الطالب R. إذا كنت أعرف ل 16 مضاعفة، وهذا هو منتج بلدي.,"It's good now, listen to student R. If I know 16 times, that's my product."
[Inaudible],student,1,0,,,,[غير مسموع],[Unheard of]
It’s Student R.  Student R.  Give Student R a chance.,teacher,10,0,,,0.0,إنه الطالب (ر) الطالب (ر) أعط الطالب (ر) فرصة,It's the student.The student.Give the student a chance.
"If you know 16, you can know 32, because you can just add another 16.",student,15,1,,1.0,,إذا كنت تعرف 16 ، يمكنك معرفة 32 ، لأنك يمكنك فقط إضافة 16 آخر.,"If you know 16, you can know 32, because you can only add another 16."
Good job.  And now somebody say add.  We could add another…,teacher,11,2,1.0,,0.0,عمل جيد والآن يقول أحدهم إضافة يمكننا إضافة آخر,Good work and now someone says add one we can add another
Timing by two.,student,3,0,,,,التوقيت في اثنين.,The time is two o'clock.
"Timing by two, that’s very good, that’s the thing I was waiting for.  And now [inaudible] is here.",teacher,18,0,,,0.0,التوقيت عند الثانية، هذا جيد جداً، هذا هو الشيء الذي كنتُ أنتظرُه، والآن هو هنا.,"The timing at two o'clock, that's very good, that's what I've been waiting for, and now it's here."
Seven hundred and [four]. Student I is not paying attention.,student,10,1,,0.0,,الطالب الأول لا ينتبه,The first student does not pay attention to the student.
"Okay, now, I want you to still kind of build it, even you know. So you build 15.  You could say I know it because I’ve done up to, and after 16 then I’ll go – listen – if I skip counting by 4, then my next one would be …",teacher,51,0,0.0,,0.0,حسناً، الآن، أريد منك أن تبنيه نوعاً ما، حتى لو كنت تعرف ذلك. لذا يمكنك أن تبنيه 15. يمكنك أن تقول أنني أعرف ذلك لأنني قمت بذلك، وبعد 16 ثم سأذهب,"Well, now, I want you to adopt it somehow, even if you know it. so you can adopt it 15. you can say I know it because I did it, and after 16 then I'll go"
"1,400.",student,1,0,,,,1400.,1400.
"No, no, hold on.  My next multiple would be, if I do skip counting by 4, the 20th…",teacher,18,1,,,0.0,لا، لا، انتظر، ضربي التالي سيكون، إذا تخطيت العد بـ4، العشرين...,"No, no, wait, my next multiplication will be, if I pass the count of four, twenty..."
"24, 28.",student,2,0,,,,24، 28,"24, 28, and 24."
Yeah.,teacher,1,0,,,0.0,-أجل، أجل,"- Yes, yes, yes"
28 … 32!,student,3,0,,,,28 ... 32!,Twenty-eight ... thirty-two!
"Good job.  Good job.  Now I’m going to let people see and we’ll walk around.  Mr. R is here now, and he’s going to walk around and see people who not only built a multiple tower up to the 32nd, but they will write the division, which is kind of the opposite, okay? All right.  Now you may go back to your seat, and then we’ll come back to see what did you learn. You’re already there? So you need to do it kind of [inaudible]. Rio? I don’t have a Rio marker, I only have this. Are you sure you want to? Just kind of make it.",teacher,108,2,,,0.0,عمل جيد. عمل جيد. الآن سأدع الناس يرون وسنمشي حولها. السيد آر هنا الآن، وسوف يمشي حولها ويرى الناس الذين لم يقتصروا على بناء برج متعدد حتى الثالث والثلاثين، ولكنهم سيكتبون التقسيم، والذي هو نوعا ما العكس، حسناً؟ الآن يمكنك العودة إلى مقعدك، ومن ثم سنعود لرؤية ما تعلمته. أنت هناك بالفعل؟ لذلك يجب عليك القيام بذلك نوعاً ما [غير قابل للسمع]. ريو؟ ليس لدي علامة ريو، لدي فقط هذا. هل أنت متأكد من أنك تريد ذلك؟ فقط نوعاً ما قم بذلك.,"Now I'm going to let people see and walk around. Mr. R is here right now, and I'm going to walk around and see people who not only built multiple towers until the 33rd, but they're going to write the split, which is kind of the opposite, okay? Now you can go back to your seat, and then we'll go back to see what you've learned."
I did 16 so now it’s time to do the 36.,student,11,0,,0.0,,لقد فعلت 16 لذا الآن حان الوقت للقيام بال36,I've done 16 so now it's time to do 36.
I’ll come to you.  You build it up to 32nd.  You need to build it up to…,teacher,17,0,0.0,,0.0,سأأتي إليك، ستبنيها إلى 32، يجب أن تبنيها إلى...,"I will come to you, build it to 32, you must build it to..."
32nd.,student,1,0,,,,الثالث والثلاثين,Thirty-third and thirty-third.
"So sit down.  So you’re doing the equation, then you’re going to do up to the 32nd.  Good job.",teacher,19,1,,,0.0,لذا اجلس. إذا كنت تفعل المعادلة، ثم سوف تفعل حتى الثالث والثلاثين. عمل جيد.,"So sit down. If you do the equation, then you will do until the thirty-third."
I need a marker.,student,4,0,,,,أحتاج إلى علامة.,I need a sign.
"I don’t have a marker, I have those [inaudible].",teacher,9,0,,,0.0,ليس لديّ علامة، لديّ تلك [غير مسموعة].,"I don't have a sign, I have that one [unheard of]."
I have a marker.,student,4,0,,,,لدي علامة,I have a sign
"You do? Student I, maybe you should do it up here, not on the desk. Let’s see, how are you doing?",teacher,21,0,,,0.0,الطالب الأول، ربما عليك القيام بذلك هنا وليس على الطاولة، دعونا نرى كيف حالك؟,"Student number one, maybe you should do it here and not on the table, let's see how you do?"
Real good.,student,2,0,,,,جيد جداً,"Very good, very good."
"Okay, let me see what Student J is doing.  Oh, you already did your equation.  You did the equation already?",teacher,20,2,,,0.0,حسناً، دعني أرى ما الذي يفعله الطالب (جاي) لقد قمت بعملية المعادلة بالفعل,"Well, let me see what the student (Jay) does."
Yeah.,student,1,0,,,,-أجل، أجل,"- Yes, yes, yes"
So is that what you’re doing?,teacher,6,0,,,0.0,إذاً هل هذا ما تفعله؟,So that's what you do?
I already did my equation.,student,5,1,,,,لقد قمت بعمل معادلتي,I've made my equation.
Good job.,teacher,2,0,0.0,,0.0,عمل جيد,Good practice is good practice.
I’m going up to 32.,student,5,0,,,,سأصعد إلى 32,I'm going up to 32.
"32nd, good job.",teacher,3,0,0.0,,0.0,الثامنة والثلاثين، عمل جيد.,"Thirty-eight, good work."
"Mr. J, I need to start going like this because I don’t have any space left.",student,16,0,,0.0,,سيّد (جاي) ، عليّ البدء بهذه الطريقة لأنّي لا أملك أيّ مساحة.,"Sir, I have to start this way because I don't have any space."
You could do the second 16th right up here.,teacher,9,0,0.0,,0.0,يمكنك أن تفعل الثاني 16 هنا.,You can do the second 16 here.
Okay.  I just need to separate them first.,student,8,0,,0.0,,حسناً، يجب أن أفرقهما أولاً,"Well, I have to separate them first."
"Maybe Student J didn’t get what we are doing.  We did up to 16th, right? Then we’re going to build it up to the 32nd and then write the division equation.",teacher,31,2,0.0,,0.0,ربما الطالب J لم يحصل على ما نقوم به. فعلنا حتى 16، أليس كذلك؟ ثم نحن ذاهبون إلى بناء حتى 32 ثم كتابة معادلة التقسيم.,"Maybe student J didn't get what we're doing. We did until 16, didn't we? Then we're going to build up to 32 and then write the division equation."
I already did this.,student,4,0,,,,لقد فعلت هذا بالفعل,I've already done that.
You know what? I want you to build the tower to be more effective. How did you break it? How did you break it?,teacher,24,0,,,1.0,أريدك أن تبني البرج لتكون أكثر فعالية كيف كسرته؟,"I want you to build the tower to be more efficient, how did you break it?"
[Inaudible],student,1,0,,,,[غير مسموع],[Unheard of]
"How did you break it.  For the base one, look at that.  What was your base number?",teacher,17,0,,,1.0,كيف كسرتها، بالنسبة للقاعدة الأولى، انظر إلى ذلك، ما هو رقم القاعدة الخاص بك؟,"How did you break it, for the first rule, look at that, what's your rule number?"
45.,student,1,0,,,,45,45 45
"Now, what is your fifth number or your sixth number? What is your sixth multiple?",teacher,15,1,,,0.0,الآن، ما هو رقمك الخامس أو رقمك السادس؟ ما هو عددك السادس المتعدد؟,"Now, what is your fifth number or your sixth number?"
My sixth multiple is 270.,student,5,1,,,,ضربي السادس هو 270.,Multiplying the sixth is 270.
"So 45, see if you use a marker, don’t use different color markers, use one, yes, that’s very good.  See?  Very good. Now, what was…  Good job.  Now, what is the equation for that?",teacher,34,1,0.0,,0.0,إذاً، 45، انظر إذا كنت تستخدم علامة، لا تستخدم علامات ملونة مختلفة، استخدم واحدة، نعم، هذا جيد جداً. ترى؟ جيد جداً. الآن، ما كان... عمل جيد. الآن، ما هي المعادلة لذلك؟,"So, 45, see if you're using a symbol, don't use different colored symbols, use one, yes, that's very good. see? very good. now, what was that... good work. now, what's the equivalent of that?"
The equation?,student,2,1,,,,المعادلة؟,The equation?
45…,teacher,1,0,,,0.0,45...,45...
Times 45?,student,2,0,,,,45 مرة؟,Forty-five times?
"No, look at it.",teacher,4,0,,,0.0,لا، انظري إليها,"No, look at her."
6 times 45.,student,3,0,,,,6 × 45,6 × 45
"Thank you, 6 times 45.  Okay, okay. So you write the equation, but remember you’re going to build… You predict, that’s good, that’s one of the things.  Can you predict the equation?  I know or I predict that my next…",teacher,40,2,,,0.0,شكراً، 6 × 45. حسناً، حسناً، حسناً، إذاً أنت تكتب المعادلة، ولكن تذكر أنك ستبني... أنت تتوقع، هذا جيد، هذا واحد من الأشياء. هل يمكنك التنبؤ بالمعادلة؟,"Well, well, well, well, then you're writing the equation, but remember that you're going to build... you're expecting, that's good, that's one of the things."
"I doubled this, [inaudible].",student,4,0,,,,أنا مضاعفة هذا، [غير مسموع].,"I'm doubling this, [unheard of]."
"Wait a minute, can you write the equation? 45 times what would you give you this number?",teacher,17,1,,,1.0,انتظر لحظة، هل يمكنك كتابة المعادلة؟ 45 مرة ما الذي ستعطيه هذا الرقم؟,"Wait a minute, can you write the equation 45 times what would you give this number?"
Would give you that number?,student,5,0,,,,هل أعطيك هذا الرقم؟,Can I give you this number?
"Yeah, can you write the equation? 45 times what?",teacher,9,1,0.0,,0.0,نعم، هل يمكنك كتابة المعادلة؟,"Yes, can you write the equation?"
8?,student,1,0,,,,ثمانية؟,Eight?
No.  45 times…,teacher,3,0,,,0.0,لا، 45 مرة...,"No, 45 times..."
16.,student,1,0,,,,16.,16.
Is this.,teacher,2,0,,,0.0,هذا هو.,That's him.
820.,student,1,0,,,,820.,820.
But for the 32nd.,teacher,4,0,,,0.0,لكن للثلاثين,But for thirty
"Oh, 45 times 32.",student,4,0,,,,45 × 32,32 × 45 
"45 times 32nd, yeah.  That’s your prediction.  Equal…",teacher,8,0,,,0.0,45 × 32، نعم، هذا هو التنبؤ الخاص بك.,"45 × 32, yes, that's your prediction."
[Inaudible],student,1,0,,,,[غير مسموع],[Unheard of]
"Good job.  Now, I want you to effectively investigate, if I keep on building, let’s see if you’re going to get to this number.  It’s like an investigation.",teacher,28,0,,,0.0,حسناً، أريدك أن تبحث بشكل فعال، إذا استمرت في البناء، لنرى إن كنت ستصل إلى هذا الرقم.,"Well, I want you to search actively, if you keep building, let's see if you can get to that number."
This is in the way.,student,5,0,,,,هذا في الطريق.,This one's on the way.
"Just go around, that’s fine.",teacher,5,0,0.0,,0.0,إذهبي فحسب، لا بأس.,"Just go, it's all right."
Look what I’m doing.,student,4,0,,,,انظر ماذا أفعل,Look what I'm doing.
"What are you doing? Oh, so you’re doing by 4.  Good job.  So you went to 16.  So you’re doing by groups of…",teacher,23,0,,,0.0,ما الذي تفعله؟ إذاً أنتِ تقومين بـ 4، عمل جيد، لذا ذهبتِ إلى 16، لذا أنتِ تقومين بـ...,"So you're doing 4, good work, so you went to 16, so you're doing..."
Four.,student,1,0,,,,أربعة.,Four.
