text,speaker,talktime_words,math_density,uptake,student_reasoning,focusing_questions,text_arabic,text_back_translated
"Good job, good job. So you’re on 24th, the next number would be?",teacher,13,0,,,0.0,عمل جيد، عمل جيد، إذاً أنت في الرابع والعشرون، والرقم التالي سيكون؟,"Good job, good job, so you're twenty-four, and the next number will be?"
"32 … um, 28.",student,4,0,,,,32... امم، 28,"32... um, 28"
Good job.  Then 32.,teacher,4,0,,,0.0,عمل جيد، ثم 32,"Good work, then 32"
This is my big equation.,student,5,1,,,,هذه هي معادلتي الكبيرة,This is my big equation.
Your big equation for up to 16.,teacher,7,1,1.0,,0.0,المعادلة الكبيرة الخاصة بك حتى 16.,Your big equation up to 16.
"Yes, and my big equations.",student,5,1,,,,نعم، ومعادلاتي الكبيرة.,"Yes, and my big equations."
"All right, so your base number was 72.",teacher,8,0,0.0,,0.0,حسناً، إذاً رقمك الأساسي كان 72.,"Well, then your base number was 72."
Yes.,student,1,0,,,,-أجل، أجل,"- Yes, yes, yes"
"And one time, okay, up to 16.  Now can you predict?  Predict what the 32nd.  Because I have this, then I can predict my…",teacher,24,0,,,0.0,ومرة واحدة، حسنا، حتى 16 الآن هل يمكنك التنبؤ؟,"And once, well, up to 16 now can you predict?"
So I can keep on building?,student,6,0,,,,حتى أتمكن من مواصلة البناء؟,So I can continue building?
"Yes, exactly, you keep on building.  And up to thirty….",teacher,10,0,1.0,,0.0,نعم، بالضبط، تستمر في البناء وحتى الثلاثين...,"Yes, exactly, it continues to be built up to thirty..."
32.,student,1,0,,,,32.,32. 32.
"See, what he did, he kind of did, from 16 he jumped, he kind of got a group of 4.  He went from 16 to 20th.  Then 20th to 24th.  24th to… What would be the next?",teacher,37,0,,,0.0,ماذا فعل، نوعاً ما فعل، من 16 قفز، نوعاً ما حصل على مجموعة من 4، ذهب من 16 إلى 20، ثم من 20 إلى 24، 24 إلى... ماذا سيكون التالي؟,"What did he do, sort of did, from 16 jumps, sort of got a set of 4, went from 16 to 20, then from 20 to 24, 24 to... What's next?"
"The 24th to the 30th, and then…",student,7,0,,,,من الرابع والعشرين إلى الثلاثين ومن ثم...,From the 24th to the 30th and then...
24th…,teacher,1,0,1.0,,0.0,الشارع 24,24th street
24th…,student,1,0,,,,الشارع 24,24th street
"If I do it by four-digit, four group.  My tower, it would go from…",teacher,14,1,,,0.0,إذا قمت بذلك بأربعة أرقام، أربعة مجموعات، برجي، سيكون من...,"If you do this with four numbers, four sets, a tower, it will be of..."
44 to…,student,2,0,,,,44 إلى...,44 to the...
"No, not 44.  You jumped from 16…",teacher,7,0,,,0.0,لقد قفزت من 16...,I jumped from 16...
So I’m going to go all the way to 32.,student,10,0,,0.0,,لذا سأذهب إلى 32.,So I'm going to go to 32.
"Now some people are making it too long.  You know, you don’t need to make it that fancy.  Because you started on the perfect one.  Why do you… See, he’s…",teacher,30,0,0.0,,1.0,الآن بعض الناس يجعلون الأمر طويلاً جداً لا يجب عليك أن تجعله جميلاً لأنك بدأت بالشيء المثالي,Now some people make it too long you don't have to make it pretty because you're starting with the perfect thing.
"Yeah, he’s kind of like built them all.",student,8,0,,0.0,,أجل، إنه نوعاً ما قام ببناءهم جميعاً,"Yeah, he kind of built them all up."
"He’s doing fine.  I was afraid you weren’t going to make it, but you are doing fine.  But you shouldn’t start another one. Because you did very well.  Where is the other one? Keep building on it.",teacher,37,0,1.0,,0.0,إنه بخير. كنت أخشى أنك لن تنجح، لكنك بخير. ولكن لا يجب أن تبدأ واحدة أخرى. لأنك فعلتها بشكل جيد جداً. أين الأخرى؟ استمر في البناء عليها.,"He's fine. I was afraid you wouldn't succeed, but you're fine. But you shouldn't start another one. Because you did it very well."
I’ve done the 30th.,student,4,0,,,,لقد قمت بالثلاثين,I've already made thirty.
"Keep building on that side now, because you did 4th, 8th, 12th, what would be your next?",teacher,17,0,,,0.0,استمر في البناء من هذا الجانب الآن، لأنك فعلت الرابع، الثامن، الثاني عشر، ما سيكون التالي الخاص بك؟,"Keep building from this side now, because you've done the fourth, eighth, twelfth, what will be your next one?"
I did a group of 5.,student,6,0,,,,لقد عملت مجموعة من الخمسة,I've worked with a group of five.
You did by 5?  Group of 5. Good.,teacher,8,0,1.0,,0.0,-كنت في مجموعة من الخامسة,-I was in a group of five
"Mr. J, I got it.  I did 72 times 32, which equals …",student,13,0,,0.0,,سيّد (جاي) ، فهمتُه، فعلتُه بـ72 × 32، وهو ما يعادل...,"Mister (Jay), I get it, I did it with 72 x 32, which is equivalent to..."
"Wait a second.  Wait a second.  If I go from 16, the equation is a thousand? How could it be?",teacher,20,2,0.0,,1.0,انتظر لحظة، انتظر لحظة، إذا ذهبت من 16، فإن المعادلة هي ألف؟ كيف يمكن أن يكون؟,"Wait a minute, wait a minute, if you go from 16, the equation is a thousand?"
"Oh, I didn’t mean [inaudible].",student,5,0,,,,أوه، لم أقصد [غير مسموع].,"Oh, I didn't mean [unheard of]."
"Good job, good job, very good. How are you doing? Let’s see this.  So how did you start?",teacher,18,0,0.0,,1.0,عمل جيد، عمل جيد، جيد جداً كيف حالك؟ دعونا نرى هذا. كيف بدأت؟,"Good work, good work, very good how are you? let's see this. how did you get started?"
I built my tower that I was working with…,student,9,0,,0.0,,بنيتُ برجِي الذي كنتُ أعملُ مع...,I built my tower that I was working with...
"See, 1, 5, and my 5th digit.",teacher,7,1,0.0,,0.0,انظر، 1، 5، والرقم الخامس.,"See, 1, 5, and the number five."
10th.,student,1,0,,,,العاشرة,The tenth
"Put the 10th, put it next to it.  10th.  You didn't put the “th”.  Good job.  No, it’s T-H.",teacher,19,0,,,0.0,ضع العاشرة، ضعها بجوارها، العاشرة، لم تضع العاشرة، عمل جيد.,"Put a tenth, put it next to it, a tenth, didn't put a tenth, good job."
"Oh, T-H.",student,2,0,,,,أوه، T-H.,"Oh, T-H."
"Yeah, that is the order.  The rank.  15th. Good job. Now, Student K, Student K, see, you started another one. And that will take you longer.",teacher,26,0,,,0.0,أجل، هذا هو الترتيب، الرتبة الخامسة عشرة، عمل جيد، الآن، الطالب ك، الطالب ك، انظر، بدأت واحدة أخرى، وهذا سيستغرق لك وقتًا أطول.,"Yes, that's the order, fifteenth place, good work, now, student K, student K, look, I started another one, and that will take you longer."
[Inaudible],student,1,0,,,,[غير مسموع],[Unheard of]
"I know, but you won’t have done the thing.  Where is the other one you started yesterday?",teacher,17,0,,,0.0,أعلم، لكنّك لن تفعلي ذلك الشيء، أين الآخر الذي بدأتيه بالأمس؟,"I know, but you're not going to do that thing, where's the other one you started yesterday?"
"I did 68, but it was supposed to be 12.",student,10,0,,0.0,,لقد فعلت 68، ولكن كان من المفترض أن يكون 12.,"I did 68, but it was supposed to be 12."
"So I don’t think you’ll get a chance to make it up to 32nd, because you’re already up to 20th, right? So what would be your 24th digit? Is it 24th? This is 20, 20th, so your next would be?",teacher,40,1,0.0,,0.0,لذا أنا لا أعتقد أنك ستحصل على فرصة للقيام بها إلى 32، لأنك قد وصلت بالفعل إلى 20، أليس كذلك؟ إذن ما هو رقم 24 الخاص بك؟ هل هو 24؟ هذا هو 20، 20، لذلك سيكون رقمك التالي؟,"So I don't think you'll get a chance to make it to 32, because you've already made it to 20, right?"
"24, plus this.",student,3,0,,,,24، بالإضافة لهذا.,"24, in addition to this."
"No, but you need to put it here.  So are you going to bring it up this way, your tower? Yeah, that would be nice. Then you’re going to have another 16?",teacher,32,0,,,0.0,لا، ولكن عليك أن تضعها هنا، لذا هل ستجلبها بهذه الطريقة، برجك؟ أجل، سيكون ذلك لطيفاً، ثم ستحصل على 16 أخرى؟,"No, but you have to put it here, so will you bring it this way, tower? Yeah, that would be nice, and then you'll get 16 more?"
See this one is the…,student,5,0,,,,أترين هذا هو...,Do you see that this is...
"That’s why I said you didn’t need to do another one, you could have just keep on building.",teacher,18,0,0.0,,0.0,لهذا السبب قلت أنك لا تحتاج إلى القيام بعمل آخر، يمكنك فقط الاستمرار في البناء.,"That's why I said you don't need to do any more work, you can just keep building."
"I already did this one, so I’m going to keep on adding the numbers.",student,14,0,,0.0,,لقد فعلت هذا بالفعل، لذلك سأستمر في إضافة الأرقام.,"I've already done this, so I'll keep adding numbers."
"Okay, all right. How is she doing?",teacher,7,0,0.0,,0.0,حسناً، كيف حالها؟,"Well, how is she?"
I’m almost done.  I need four more to get to 32.,student,11,0,,0.0,,أنا على وشك الانتهاء، أحتاج إلى أربعة أخرى للوصول إلى 32.,"I'm about to finish, I need four more to get to 32."
Good job.,teacher,2,0,0.0,,0.0,عمل جيد,Good practice is good practice.
I couldn't do it so I’m going to go like that.,student,11,0,,0.0,,لم أستطع فعلها لذا سأذهب هكذا,"I couldn't do it, so I'm going like this."
So what did you do?,teacher,5,0,0.0,,1.0,إذاً ماذا فعلت؟,So what did you do?
I just keep on [inaudible].,student,5,0,,,,أنا فقط أستمر [غير مسموع].,I just keep going.
"Wait a minute.  So did you predict times 16 is 1,152.",teacher,11,0,0.0,,1.0,"انتظر لحظة هل توقعت ضرب 16 هو 1,152","Wait a minute, did you expect times 16 to be 1,152?"
And I’m going to put another equation here.,student,8,1,,0.0,,وسأضع معادلة أخرى هنا,And I'm going to put another equation right here.
"Yeah, times 32.",teacher,3,0,0.0,,0.0,أجل، مرّة 32.,"Yes, the 32nd time."
"Times 32, which is going to get me to whatever number I get for 32.",student,15,0,,0.0,,ضرب 32، والذي سيأخذني إلى أي رقم سأحصل عليه من أجل 32.,"Multiply 32, which will take me to any number I get for 32."
So can you do it?,teacher,5,0,0.0,,0.0,إذاً، هل يمكنك فعل ذلك؟,"So, can you do that?"
Yes.,student,1,0,,,,-أجل، أجل,"- Yes, yes, yes"
"What you need to do to be more effective, you could just keep on counting.",teacher,15,0,,,0.0,ما عليك القيام به ليكون أكثر فعالية، يمكنك فقط مواصلة العد.,"What you need to do to be more effective, you can just keep counting."
"Yeah, that’s what I’m going to do.",student,7,0,,,,أجل، هذا ما سأفعله,"Yeah, that's what I'm going to do."
"Okay, good.",teacher,2,0,1.0,,0.0,حسناً، جيد,"Well, that's good."
"And when I get to the 32, mark it 32 times, 6 times 72, and I’m going to put it right next to it.",student,24,0,,0.0,,وعندما أصل إلى 32، قم بتسجيل 32 مرة، 6 مرات 72، وسأضعها بجوارها.,"And when I get to 32, record 32 times, 6 times 72, and I'll put it next to it."
"You are good. So that would be, the 16th…",teacher,9,0,0.0,,0.0,أنتِ جيّدة، لذا سيكون ذلك في السادس عشر...,"You're good, so it will be on the 16th..."
That’s my 17.,student,3,0,,,,هذا هو 17 لي.,That's 17 for me.
"17, 18, 19, 20th, very good.",teacher,6,0,,,0.0,17، 18، 19، 20، جيد جدا.,"17, 18, 19, 20, very good."
"When I got here, I got this number.",student,8,0,,0.0,,عندما وصلت هنا، حصلت على هذا الرقم.,"When I got here, I got this number."
"Hmmm, so the 20th, 20th number, 20th multiple of what number? What was your base number again?",teacher,17,1,0.0,,0.0,إذن العدد العشرين، العشرين، العشرين مضاعف من أي رقم؟ ما هو رقم أساسك مرة أخرى؟,"So the number twenty, twenty, twenty multiplied by what number? what is your base number again?"
48.,student,1,0,,,,48.,48.
The 20th multiple of 48 is … Good job. 8 times 8?,teacher,12,1,,,0.0,المضاعف العشرين من 48 هو... عمل جيد. 8 × 8؟,Twenty times 48 is... good work. 8 × 8?
"Oh, 64.",student,2,0,,,,أوه، 64.,"Oh, 64."
"[Laughs] That’s why you’re making, see, when you’re doing it, if you skip, if you’re doing it the way you build the tower, see if you do it this way, probably you won’t get it.  But the effective way would be, what can you do?",teacher,45,0,,,0.0,[ضحك] لهذا السبب تقومون، انظروا، عندما تقومون بذلك، إذا قفزتم، إذا كنتم تفعلون ذلك بالطريقة التي تقومون بها ببناء البرج، انظروا إذا قمتم بها بهذه الطريقة، ربما لن تحصلوا عليها. ولكن الطريقة الفعالة ستكون، ما الذي يمكنك القيام به؟,"[Laughter] That's why you do, look, when you do it, if you jump, if you do it the way you build the tower, look, if you do it this way, you probably won't get it."
"1,226.",student,1,0,,,,1226,1226 1226
"That’s what it is.  Now how do you know, what did you do?",teacher,13,0,,,1.0,هذا ما هو عليه الآن كيف تعرف ماذا فعلت؟,"This is what it is now, how do you know what you did?"
Add 48 more.,student,3,1,,,,إضافة 48 أخرى.,Add another 48.
"Good job.  So, hey, that multiple tower is keep on adding 48. So did you keep on adding 48 today?",teacher,20,1,,,0.0,حسناً، هذا البرج المتعدد يستمر في إضافة 48، لذا هل استمر في إضافة 48 اليوم؟,"Well, this multipurpose tower continues to add 48, so will it continue to add 48 today?"
Mm-hmm.,student,1,0,,,,-حسناً,-Well then
"Okay.  How are you doing, Student R?  Good.  So your base number, 15, and you get to the 16th multiple?",teacher,20,1,,,0.0,حسناً، كيف حالك، الطالب (ر) ؟,"Well, how are you, student?"
No.,student,1,0,,,,-كلا .,"- No , not at all ."
"So you’re still doing the 16th multiple, okay.  So you’re on the 15th.  What do you do? Do you keep on adding, 15? And what is your 15th?",teacher,28,1,,,0.0,إذاً ما زلت تقوم بالعدد الـ16، حسناً، إذاً أنت في الـ15، ماذا تفعل؟ هل تستمر في إضافة الـ15؟ وما هو الـ15؟,"So you're still doing the number 16, okay, so you're at 15, what are you doing? Do you keep adding the 15? What's the 15?"
[Inaudible].,student,1,0,,,,[غير مسموع].,[Unheard of].
"Student R, are you helping him?",teacher,6,0,,,0.0,الطالب (ر) ، هل تساعده؟,"Student, can you help him?"
"You’re supposed to start on 16, right?",student,7,0,,,,من المفترض أن تبدأ في 16، أليس كذلك؟,"You're supposed to start at 16, aren't you?"
"16th.  Keep on going, just like you, keep on going to the 32nd.",teacher,13,0,0.0,,0.0,16، استمروا، كما تفعلون، استمروا بالذهاب إلى 32,"16, keep going, as you do, keep going to 32."
That’s what I tried to do.,student,6,0,,,,هذا ما حاولت فعله,That's what I tried to do.
"We have five more minutes, and I need someone that can share? You could share your 32nd multiple of whatever…",teacher,20,1,0.0,,0.0,لدينا خمس دقائق أخرى، وأحتاج لشخص يمكنه أن يشارك؟,"We have five more minutes, and I need someone who can participate?"
[Inaudible] crawled into my multiplication tower.,student,6,1,,,,[غير مسموع] تسلل إلى برج ضربي.,[Unheard] sneaked into the multiplication tower.
"Okay.  Then we need to see your division, your division equation. Student R? Student R now.  Guys, guys, guys, you need to sit and get it going. Let’s see, how far are you? How are you doing?",teacher,37,3,0.0,,0.0,حسناً، علينا أن نرى تقسيمك، معادلة تقسيمك، الطالب ر؟ الطالب ر الآن، يا رفاق، يا رفاق، عليكم أن تجلسوا وتبدأوا، دعونا نرى، كم تبعدون؟ كيف حالكم؟,"Okay, we need to see your division, your division equation, student r? student r Now, you guys, you guys, you guys, you need to sit down and start, let's see, how far away are you?"
[Inaudible].,student,1,0,,,,[غير مسموع].,[Unheard of].
"So are you ready to share your 32nd? You are on…  25 times 25 is equal …  No, I don’t know, I’m trying to question to you.  And then we could ask you, what would be the division, the equation for… Okay? So think about it. Whatever you get up to, it doesn’t matter.  So I need you to kind of finish wherever you are.  Student R?  Finish wherever you are and then think of the multiplication, the multiples…",teacher,79,4,,,0.0,إذاً هل أنت مستعد لتقاسم الثالثة والثلاثين؟ أنت على... 25 × 25 يساوي... لا، لا أعرف، أنا أحاول أن أسألك. ومن ثم يمكننا أن نسألك، ما سيكون التقسيم، المعادلة ل... حسناً؟ فكري في الأمر.,"So are you ready to divide by thirty-three? you're on... 25 × 25 is equal to... no, I don't know, I'm trying to ask you. and then we can ask you, what would be the division, the equation for... okay? think about it."
Am I going to fit multiples to 50?,student,8,1,,0.0,,هل سأطابق مضاعفات إلى 50؟,Am I going to match multiples to 50?
"To 50? You think you can get to that? That’s fine.  Can you predict? You can predict up to 50, because you did it up to 25, then can you predict up to 50? That’s good.  Then we’re going to kind of share. Now, listen, listen, listen.  Student K, come here and finish this. Then we’ll do the roller coaster park. Three minutes.  Wherever you get is fine.  You can share. Now, I don’t see your equation, Student K. Wherever you get…  Write an equation.  And you didn't write an equation for any of these.  So do them.",teacher,98,3,1.0,,0.0,إلى 50؟ هل تعتقد أنه يمكنك الوصول إلى ذلك؟ هذا جيد. هل يمكنك التنبؤ؟ يمكنك التنبؤ حتى 50، لأنك فعلت ذلك حتى 25، ثم يمكنك التنبؤ حتى 50؟ هذا جيد. ثم سنقوم بتقاسم نوعا ما. الآن، اسمع، اسمع، اسمع. الطالب K، تعال هنا وانتهى من هذا. ثم سنقوم بـ حديقة الرحلات الجوية. ثلاث دقائق. أينما تصلين هو جيد. يمكنك تقاسم. الآن، أنا لا أرى معادلتك، الطالب K. أينما تصلين ... كتابة معادلة. وأنت لم تكتب معادلة لأي من هذه. لذلك قم بها.,"Do you think you can get to 50? That's good. Can you predict? You can predict up to 50, because you did it up to 25, then you can predict up to 50? That's good. Then we're going to sort of share. Now, listen, listen, listen. Student K, come here and finish this. Then we're going to do an airplane park. Three minutes. Wherever you get to is good. You can share. Now, I don't see your equation, student K. Wherever you get to"
"Okay.  I’m sorry, I thought I had to stop right there.",student,11,0,,0.0,,حسناً، أنا آسفة، ظننت أن عليّ التوقف هنا,"Well, I'm sorry, I thought I should stop here."
"Three minutes. Okay, 15 times 16 is…",teacher,7,0,0.0,,0.0,ثلاث دقائق حسناً، 15 × 16 هي...,"Three minutes well, 15 × 16 is..."
240.,student,1,0,,,,240.,240.
"2,040, wow.  So you think you can predict, you can write a prediction for 16 times 32?",teacher,17,0,,,0.0,"2,040, واو. اذا تعتقد انك تستطيع التنبؤ، يمكنك كتابة التنبؤ ل 16 × 32؟","2,040, wow. if you think you can predict, can you write a prediction for 16 × 32?"
I did for this one.,student,5,0,,,,لقد فعلت هذا,I've already done that.
"A multiple [inaudible] division.  Can you predict? Okay, so you’re ready to share your equation for the 32nd? And then, get a division.  No, no, you don’t need to give me the answer, but the whole equation.  Remember what your base number was, it’s 48? So it’s 48…",teacher,48,6,0.0,,0.0,التقسيم المتعدد. هل يمكنك التنبؤ؟ حسناً، إذاً أنت مستعد لتقاسم معادلتك للثلاثين؟ ثم، احصل على تقسيم. لا، لا، لا، لست بحاجة إلى إعطائي الإجابة، ولكن المعادلة بأكملها. تذكر ما كان رقم أساسك، هو 48؟ لذلك هو 48...,"Well, then you're ready to divide your equation by thirty? then, get a division. no, no, no, no, you don't need to give me the answer, but the whole equation. remember what your base number was, 48? so it's 48..."
Times 32.,student,2,0,,,,32 مرة,Thirty-two times.
Equal…,teacher,1,0,,,0.0,متساوية,Equal to each other
"1,536. I have to get up to what number? 25?",student,10,0,,0.0,,1536، أي رقم يجب أن أصل إليه؟,"1536, what number should I reach?"
"No, for you, you asked me to stop at 45, but you said you could predict for 50 because you know for 35. 35.   25.  Right?  So you said, oh, if I know for 25, then I can make it up to 50 or predict, right? Okay, one minute. Nice work. A few minutes. Oh, so you just do skip counting by 15.  Oh, I thought you were going to do this number up to…",teacher,75,0,1.0,,0.0,لا، بالنسبة لك، طلبت مني التوقف عند 45، ولكنك قلت أنك تستطيع التنبؤ بـ 50 لأنك تعرف بـ 35، 35، 25، صحيح؟ لذا قلت، أوه، إذا كنت أعرف بـ 25، فيمكنني أن أصل إلى 50 أو التنبؤ، أليس كذلك؟ حسنا، دقيقة واحدة. عمل جيد. بضع دقائق.,"No, for you, you asked me to stop at 45, but you said you could predict 50 because you know 35, 35, 25, right? So I said, oh, if I knew 25, I could get to 50 or predict, right?"
"Oh, up to 50.",student,4,0,,,,أوه، حتى 50.,"Oh, even 50."
"The 50th multiple.  It’s not up to 50, but it’s up to the 50th multiple. Student K?",teacher,17,2,,,0.0,المضاعف الخمسين، ليس حتى الخمسين، لكنه حتى المضاعف الخمسين. الطالب ك؟,"Fifty times fifty, not even fifty, but even fifty times fifty."
Yes.,student,1,0,,,,-أجل، أجل,"- Yes, yes, yes"
"I don’t appreciate you not doing the work, and you are just, you know, when I ask you the equation and the prediction. At least you could write the prediction. So make sure you have a prediction.  Even if you didn't get to the 32nd write the prediction.  Write the prediction, and then we could go back and prove it, that means, make sure we investigate. Now, you may sit and share with us.   Okay, now I need everyone. Student N, Student N, I’m waiting.  Student V.  I just need you back.  I need your attention back, Student S. You need to put your pencil down please, or pen.  Excuse me, pen and pencil.  Pen and pencil.  Let’s wait for… Good job, Student I.  Good job, Student K.  Student R, good job.  Student K. Student N, good job.  He’s waiting.  We need everybody’s attention.  Student S, good job.  Student S, put it down. Good job. Now, I need someone that can share what did we learn? What did we learn by doing this investigation? By doing this investigation.  Student R, I’m talking to you.  See, she didn’t.  Some people did not put their pen and pencil, markers, crayons, put them down.  I want you to think. Yes, Student K, what did you learn?",teacher,213,1,,,0.0,أنا لا أقدر أنك لا تقوم بالعمل ، وأنت فقط ، كما تعلمون ، عندما أسألك عن المعادلة والتنبؤ. الطالب V. أنا فقط أحتاجك مرة أخرى. أنا بحاجة إلى انتباهك مرة أخرى ، الطالب S. يجب أن تضع قلمك ، أو قلمك. عذراً ، وقلمك وقلمك. رجاءً انتظر ... جيد ، الطالب I. وظيفة جيدة ، الطالب K. R. ، وظيفة جيدة. نعم ، ما الذي قام به بعض الطالب.,"I don't appreciate you not doing the work, and you just, you know, when I ask you about the equation and the prediction. Student V. I just need you again. I need your attention again, student S. You should put your pen, or pen. Excuse me, your pen, and your pen. Please wait... Good, student I. Good job, student K.R., good job. Yes, what some student did."
12.,student,1,0,,,,12,12  12 
So your base number was 12.,teacher,6,0,,,0.0,إذاً الرقم الأساسي الخاص بك كان 12,So your base number was 12?
Yes.,student,1,0,,,,-أجل، أجل,"- Yes, yes, yes"
Okay.,teacher,1,0,,,0.0,-حسناً,-Well then
146.,student,1,0,,,,146.,146.
