text,speaker,talktime_words,math_density,uptake,student_reasoning,focusing_questions,text_arabic,text_back_translated
"Okay.  All right.  All right.  Today we’re gonna continue with making our boxes.  But we’re gonna do something a little bit different today.  Today, the packaging factory doesn’t want all the same size packages.  And, remember that each of our cubes was a package?  And the things we made were the box. Now, we’re gonna have some different size packages in our boxes today.  So, we’re gonna have a package that looks like this.  Like this.  Like this.  A nice long one.  And then a real big package and one that looks like this. So, what we’re gonna begin to do this morning is I’m going to give you the worksheet and I’m going to have you make a box. Everybody is making the same box today and it’s already framed for you.  All right?  So, you’re gonna make this box and you have the extensions to put on the box. So, everybody’s gonna make a box.  When I give you the sheet I’m gonna ask you to tell me what size box you think this is going to be.  Okay?  So, could you pass them out?  I can’t have Student D pass them out because he is not part of the [Inaudible]. Okay, Student J.  I’m sorry, Student J, what did you say?",teacher,214,1,,,0.0,حسناً. حسناً. اليوم سنستمر في صنع صناديقنا. لكن اليوم سنفعل شيئاً مختلفاً قليلاً. اليوم، مصنع التغليف لا يريد جميع صناديق الحجم نفسه. وتذكر أن كل واحد من كوباتنا كان صناديقاً. والأشياء التي صنعناها كانت الصندوق. الآن، سنحصل على بعض صناديق الحجم المختلف في صناديقنا اليوم. لذا، سنحصل على صناديق تبدو على هذا النحو. على هذا النحو.,"Well, today we're going to continue making our boxes, but today we're going to do something a little different. Today, the packaging factory doesn't want all boxes of the same size. Remember that each of our cups was a box. And the things we made were a box. Now, we're going to get some boxes of different sizes in our boxes today. So, we're going to get boxes that look like this. like this."
Can I get some scissors?,student,5,0,,,,هل يمكنني الحصول على مقص؟,Can I have a scissor?
"I’ll bring you some scissors, okay?",teacher,6,0,1.0,,0.0,سأحضر لك مقصاً، حسناً؟,"I'll get you a story, all right?"
Okay.,student,1,0,,,,-حسناً,-Well then
We need some of the other packages.  I need some of the other. All right.  Scissors?,teacher,16,0,,,0.0,نحن بحاجة إلى بعض الحزم الأخرى أنا بحاجة إلى بعض الآخر حسناً، مقص؟,We need some more packages. I need some more.
Mm-hm.,student,1,0,,,,-حسناً,-Well then
Anybody else need scissors here?,teacher,5,0,,,0.0,هل هناك أحد آخر يحتاج إلى مقص هنا؟,Is there anyone else here who needs a haircut?
I need scissors.  Thank you.,student,5,0,,,,أحتاج إلى مقص، شكراً,"I need a haircut, thank you."
"Okay.  You may begin cutting.  While you’re cutting I want you to think about as I finish passing out the papers, what are the dimensions of this box going to be?  If anybody knows right now.",teacher,36,1,1.0,,0.0,حسناً، يمكنكِ البدء في القطع، بينما أنتِ تقطعين أريدكِ أن تفكرين عندما أنتهي من توزيع الأوراق، ما هي أبعاد هذا الصندوق؟,"Well, you can start cutting, and while you're cutting, I want you to think when you're done handing out the paper, what are the dimensions of this box?"
Thank you. Thank you.,student,4,0,,,,شكراً، شكراً,"Thank you, thank you"
You may start cutting.  Okay.  I have to give you the extension.  There’s an extension to go around the top of the box.,teacher,23,0,,,0.0,حسناً، يجب أن أعطيك الإطالة، هناك إطالة للذهاب حول أعلى الصندوق,"Well, I have to give you an extension, there's an extension to go around the top of the box."
Teacher?  I know the dimensions.,student,5,1,,,,أنا أعرف الأبعاد,I know the dimensions.
"Well, you haven’t got the extension yet.  Here comes the extension.  All right.  Here’s the extension.  Actually you don’t need these two.  Let me just leave –",teacher,27,0,0.0,,0.0,حسناً، لم تحصل على الإطالة بعد. ها هي الإطالة. حسناً. ها هي الإطالة. في الواقع لا تحتاج إلى هذين الإثنين. دعني أرحل فقط,"Well, you haven't gotten the extension yet. here's the extension. well. here's the extension. actually you don't need these two. just let me go."
Okay. [Inaudible].  Why do we need it?,student,7,0,,,,حسناً، لماذا نحتاجها؟,"Well, why do we need them?"
Because the extension’s gonna go on the box.,teacher,8,0,1.0,,0.0,لأن الإطالة ستذهب على الصندوق.,Because the extension will go to the box.
Oh.,student,1,0,,,,-أوه .,-Oh .
"Did you get extension [Inaudible]?  You guys got two of the same.  That was [Inaudible]  problem.  You don’t need two of these.  Yeah.  If anybody does not have an extension, let me know.  After you fold the small box, the extension will go on.  Has anybody figured out just by looking at the pattern what the box is gonna look like?  You’ve got two dimensions.  You got two dimensions.  [Inaudible] said six by four.  Two dimensions.  And what’s the third dimension? Has anybody been able to figure that out?",teacher,89,4,,,1.0,هل حصلتم على امتداد؟ حصلتم على اثنين من نفسها. كانت هذه مشكلة. أنت لا تحتاج إلى اثنين من هذه. نعم. إذا كان أي شخص ليس لديه امتداد، أخبرني. بعد أن تطويق الصندوق الصغير، فسوف يستمر التمديد. هل عرف أي شخص فقط من خلال النظر إلى النمط كيف ستبدو الصندوق؟ حصلتم على ابعدين. حصلتم على ابعدين. قال [Inaudible] ستة على أربعة. ابعدين.,"Did you get an extension? did you get two of the same. that was a problem. you don't need two of these. yeah. if anyone doesn't have an extension, tell me. after enclosing the small box, the extension will continue. did anyone know just by looking at the pattern what the box would look like? you got two dimensions. you got two dimensions. said [inaudible] six on four. two dimensions."
[Inaudible]?,student,1,0,,,,[غير مسموع]؟,[Unheard of]?
Remember you have to have the extension.  And the extension shows you how it’s gonna – Box 1 is actually gonna look like.,teacher,23,0,,,0.0,تذكّر أنّكَ يجب أن تحصل على التمديد، والتمديد يُظهر لكَ كيف سيبدو الصندوق الأول في الواقع.,"Remember that you have to get an extension, and the extension shows you what the first box will actually look like."
[Inaudible],student,1,0,,,,[غير مسموع],[Unheard of]
That looks good.  Oops.  [Inaudible]. Yeah.  Here are your extensions.  Okay?  What?,teacher,12,0,,,0.0,هذا يبدو جيداً، نعم، ها هي تمديداتك، حسناً؟ ماذا؟,"That sounds good, yeah, here are your extensions, okay?"
Do you have tape?  Tape?  Tape?,student,6,0,,,,هل لديك شريط؟,Do you have a tape?
Oh.  There you go.  All right.  Anybody got a clue yet?,teacher,11,0,0.0,,0.0,حسناً، هل وجد أحدكم فكرة بعد؟,"Well, has anyone else come up with an idea yet?"
Me.,student,1,0,,,,-أنا,-It's me
We know Student A said it was six times four but we needed one more dimension.,teacher,16,1,,,0.0,نَعْرفُ الطالبِ أَنّه قَالَ هو ستة × أربعة ولكن نحن بحاجة إلى بعد واحد أكثر.,"We know the student said it was six times four, but we need one more dimension."
Six times four.  This is – Five?,student,7,0,,,,ستة أضعاف أربعة هذا هو  خمسة؟,Six times four that's five?
Times five?,teacher,2,0,1.0,,0.0,خمس مرات؟,Five times?
Times two.,student,2,0,,,,مرتين,Two times 
Times two?,teacher,2,0,,,0.0,مرتين؟,Two times?
That’s what I said.  Six times four.,student,7,0,,,,هذا ما قلته ستة مرات أربعة,That's what I said six times four.
"Okay.  Are you looking at the diagram of how to add the extension to the box?  Even though this is a three box, you’re just gonna add it after you fold your box.",teacher,33,2,0.0,,0.0,حسناً، هل تنظر إلى الرسم البياني لكيفية إضافة التوسع إلى الصندوق؟ على الرغم من أن هذا صندوق ثلاثي، ستضيفه فقط بعد أن تضع الصندوق الخاص بك.,"Well, do you look at the chart of how to add the expansion to the box? although this is a triple box, you will only add it after you put your box in."
Six times four times three.,student,5,0,,,,ست مرات أربعة مرات ثلاثة.,Six times four times three.
"Six times four times three.  Let’s everybody make it and see if it’s right.  You need to get your box made before you play with the cubes, okay?  Work with the cubes.  What?  Okay. So you need to be cutting up. Wasn’t this a double?  Yeah, you should have cut this all together. See?  Let me give you another one.  When you cut this out, you want to cut it all together.  Okay?",teacher,73,2,1.0,,0.0,ستة أضعاف أربعة أضعاف ثلاثة. دعونا جميعاً نفعل ذلك ونرى إن كان صحيحاً. عليك أن تصنع صندوقك قبل أن تلعب مع الكوبات، حسناً؟ عمل مع الكوبات. ماذا؟ حسناً. لذا عليك أن تقطع. ألم يكن هذا مضاعفاً؟ نعم، كان عليك أن تقطع كل هذا معاً. اسمحوا لي أن أعطيك واحدة أخرى. عندما تقطع هذا، تريد أن تقطع كل شيء معاً. حسناً؟,"Six times four times three. let's all do this and see if it's true. you have to make your box before you play with cups, okay? you have to work with cups. what? okay. so you have to cut. wasn't that a double? yes, you had to cut all this together. let me give you another one. when you cut this, you want to cut everything together. okay?"
Okay.,student,1,0,,,,-حسناً,-Well then
You’re supposed to [Inaudible] the dimensions.  Here’s a four. This is a four and this is –,teacher,17,1,,,0.0,من المفترض أن تعرف الأبعاد، وهنا أربعة، وهنا أربعة.,"You're supposed to know the dimensions, and here's four, and here's four."
Can we [Inaudible] Teacher?,student,4,0,,,,هَلْ يُمْكِنُ أَنْ نَكُونَ [لا يَسْمَعُ] مُعَلِّم؟,Is it possible for us to be teachers?
It’s three.  So what do you think it is?,teacher,9,0,,,1.0,إنها الثالثة، إذاً ما الذي تعتقد أنه؟,"It's the third one, so what do you think it is?"
"Eighteen? No, no.  It’s three times four times six.",student,9,0,,0.0,,ثمانية عشر؟ لا، لا، إنها ثلاث مرات أربعة مرات ستة.,"Eighteen? No, no, it's three times four times six."
Three times four times six.  Yeah.,teacher,6,0,1.0,,0.0,ثلاث مرات أربعة مرات ستة,Three times four times six
Do you put this –,student,5,0,,,,هل وضعت هذا,Did you put this on?
"Yeah.  Just like that.  You’re gonna have to tape them.  Okay? Yep. Okay.  Now that you have your boxes, I’m gonna give you the sheet and I’ll just put them in the middle of the table.  As soon as you finish the boxes made, you can pass them around and we’re gonna talk about how you do this.",teacher,58,0,1.0,,0.0,أجل، هكذا، عليك أن تسجلها، حسناً؟ حسناً، حسناً، الآن، بما أن لديك صناديقك، سأعطيك الأوراق وأضعها في منتصف الطاولة، بمجرد أن تنتهي من صناديقها، يمكنك أن تمررها، وسنتحدث عن كيفية القيام بذلك.,"Well, well, now that you have your boxes, I'll give you the papers and put them in the middle of the table, and once they're done with their boxes, you can pass them along, and we'll talk about how to do it."
Thank you. You’re not supposed to do that.  You’re supposed to put the squares on the – are you supposed to put the squares on the inside or the outside? Outside. Or it doesn’t matter?,student,35,2,,0.0,,شكراً. لا يفترض أن تفعل ذلك. يفترض أن تضع المربعات على المربعات. هل يفترض أن تضع المربعات على الداخل أم على الخارج؟ خارج. أم لا يهم؟,Thank you. you're not supposed to do that. you're supposed to put the boxes on the boxes. you're supposed to put the boxes on the inside or the outside? outside. does it matter?
"Well, if you put them on the outside you can see them but it really doesn’t matter.  You can do it either way.  The diagram had them on the outside.  Okay?  But if you did it on the inside, that’s okay.",teacher,41,0,1.0,,0.0,حسناً، إذا وضعتهم على الجانب الخارجي يمكنك رؤيتهم ولكن لا يهم حقاً، يمكنك القيام بذلك بأي طريقة. الرسم البياني كان لهما على الجانب الخارجي. حسناً؟ ولكن إذا قمت بذلك من الداخل، لا بأس بذلك.,"Well, if you put them on the outside, you can see them, but it doesn't really matter, you can do it any way."
[Inaudible] outside and [Inaudible] You looked at the back. It’s a back.,student,12,0,,0.0,,لقد نظرت إلى الخلف، إنه الخلف.,"I looked back, it's the back."
Let’s get going okay?  So we get the –,teacher,9,0,0.0,,0.0,دعونا نذهب حسنا؟ حتى نحصل على,"Let's go, all right?"
I need tape.,student,3,0,,,,أحتاج إلى شريط,I need a tape.
"Yeah.  You know, let me show you something. When you put this on, you only need little pieces of tape.  Just like – go like that.  You don’t need long pieces, okay?  Because we’ll run out of tape.  There you go.  Just like that. See.",teacher,45,0,,,0.0,أجل، دعيني أريك شيئاً، عندما تضع هذا، تحتاج فقط إلى قطع صغيرة من الشريط، فقط هكذا. لا تحتاج إلى قطع طويلة، حسناً؟ لأن الشريط سينتهي. ها أنت ذا. هكذا. انظر.,"Yeah, let me show you something, when you put this on, you just need small pieces of tape, just like that. You don't need long pieces, okay? 'cause the tape's going to end."
Okay.,student,1,0,,,,-حسناً,-Well then
You’re fine.  You’re fine.  Okay.,teacher,5,0,,,0.0,أنتِ بخير، أنتِ بخير,"You're all right, you're all right."
[Inaudible] I do need something.,student,5,0,,,,أنا بحاجة لشيء ما,I need something.
"Okay.  There.  That’s fine.  All right.  The next thing you need to – no, no, no, no, no.  You need to start reading our papers.  Okay?  So just read it.  We’re gonna do the first part together so just – just read about the packages, okay?  Boys and girls, if you finish with your box, and then you take your sheet, you can read at the top of the sheet. You can start making the packages but do not go down to the fill them in.  We’re gonna do the first one together.  So, just if you can start making the packages at the top of the sheet. Okay?  Once your box is completed.  Excellent.",teacher,115,0,0.0,,0.0,حسناً. حسناً. حسناً. الشيء التالي الذي تحتاج إليه هو أن تبدأ في قراءة أوراقنا. حسناً؟ لذا اقرأها. سنقوم بالجزء الأول معاً، لذا فقط اقرأ عن الحزمة، حسناً؟ الفتيان والفتيات، إذا أنهيتم مع صندوقكم، ثم أخذتم ورقةكم، فيمكنكم القراءة في أعلى ورقة. يمكنكم البدء في صنع الحزمات ولكن لا تذهبوا إلى أسفل لملئها. سنقوم بالجزء الأول معاً. لذا، فقط إذا كنتم تستطيعون البدء في صنع الحزمات في أعلى ورقة. حسناً؟ بمجرد أن يتم إكمال صندوقكم. ممتاز.,"Okay, well, the next thing you need is to start reading our papers. Okay? So read them. We're going to do the first part together, so just read the package, okay? Boys and girls, if you're done with your box, then you've taken your paper, you can read it at the top of the sheet. You can start making packages but don't go down to fill them. We're going to do the first part together."
We need more than one piece of tape.,student,8,0,,0.0,,نحتاج إلى أكثر من شريط واحد,We need more than one bar.
More tape dispenser?  Very good.  Okay.  Do you remember what I said you could do now?,teacher,16,0,1.0,,0.0,حسناً، أتتذكرين ما قلته لكِ أن تفعله الآن؟,"Well, remember what I told you to do now?"
Yep.,student,1,0,,,,-أجل .,- Yes .
Okay.  You take your sheet here and start making the boxes.,teacher,11,0,,,0.0,حسناً، خذ ورقك هنا وابدأ في صنع الصناديق,"Well, take your paper here and start making boxes."
Or could you – I need extra tape for this.,student,10,0,,0.0,,أَو يُمْكِنُ أَنْ تَكُونَ تَحتاجُ شريط إضافي لهذا.,Or maybe you need an extra bar for this.
"No, you’re making these out of tubes.",teacher,7,0,1.0,,0.0,لا، أنت تصنع هذه من الأنابيب.,"No, you're making these out of pipes."
"Oh, yeah.",student,2,0,,,,أوه، نعم.,"Oh, yeah."
Okay?  So you have the tubes there.,teacher,7,0,,,0.0,إذاً لديك الأنابيب هناك,So you have pipes there?
"Oh, you need it right now?",student,6,0,,,,هل تحتاجها الآن؟,Do you need it now?
Good.  You can’t get it apart?,teacher,6,0,0.0,,0.0,جيد، ألا تستطيعين تفكيكها؟,"Good, can't you undo it?"
"No, I’m trying to connect it back.",student,7,0,,,,لا، أنا أحاول ربطها مرة أخرى.,"No, I'm trying to tie it back together."
Okay.  All right.  You don’t really need –,teacher,8,0,1.0,,0.0,حسناً، حسناً، أنتِ لا تحتاجين حقاً,"Well, well, you don't really need it."
The tape’s stuck.  I’m trying to cut it.,student,8,0,,0.0,,الشريط عالق، أحاول قطعه,"The tape is stuck, I'm trying to cut it."
"I know.  You don’t really need a lot of tape to do these.  Just roll it over like that and then you just need kind of one piece for each of these.  Oh, I see.  You cut some off here?",teacher,40,0,1.0,,0.0,أعلم، لا تحتاج إلى الكثير من الشريط للقيام بذلك، فقط قم بتدويرها هكذا وبعدها تحتاج إلى قطعة واحدة لكل منها.,"I know, you don't need a lot of tape to do this, just spin it like this and then you need one piece each."
Yeah.,student,1,0,,,,-أجل، أجل,"- Yes, yes, yes"
That was a good idea.,teacher,5,0,,,0.0,لقد كانت فكرة جيدة,It was a good idea.
Yeah.  So what else [Inaudible]?,student,5,0,,,,أجل، ماذا أيضاً؟,"Yeah, what else?"
That was a good idea.,teacher,5,0,0.0,,0.0,لقد كانت فكرة جيدة,It was a good idea.
Just [Inaudible] like this.,student,4,0,,,,فقط مثل هذا.,Just like this.
All right.  I’ll kind of line up the lines.,teacher,9,2,,,0.0,حسناً، سأقوم بتحديد الخطوط,"Well, I'm going to define the lines."
That’s all right.  Then you can put a piece right there.,student,11,0,,0.0,,لا بأس، ثم يمكنك وضع قطعة هناك,"It's okay, then you can put a piece there."
"You’re all done?  Okay.  Student C, you can start making some of the packages, all right?  Out of the tubes.  Okay. You’re all done.  You want to start making your packages out of the cubes.  Do you need help?",teacher,39,1,1.0,,0.0,هل انتهيت؟ حسناً، الطالب سي، يمكنك البدء في صنع بعض الحزم، حسناً؟ من الأنابيب. حسناً، انتهيت. تريد البدء في صنع حزمك من الكوبات. هل تحتاجين المساعدة؟,"Well, student C, you can start making some packages, okay? from pipes. Okay, you're done. You want to start making your packages from cups. Do you need help?"
Yes.,student,1,0,,,,-أجل، أجل,"- Yes, yes, yes"
"Oh, where is the tape?  Oh, you can’t keep it in your lap.  You know what?  We’ll just take a big piece and we’ll cut it into smaller pieces. [Inaudible] line up the lines.  Okay?",teacher,35,2,,,0.0,أوه، أين الشريط؟ أوه، لا يمكنك الاحتفاظ به في حضنك. أتعلم ماذا؟ سنأخذ قطعة كبيرة ونقصها إلى قطع أصغر. [لا يمكن سماعها] صف الخطوط، حسناً؟,"Oh, where's the tape? Oh, you can't keep it in your lap. You know what? We're going to take a big piece and cut it into smaller pieces."
Yuk!  [Inaudible].  No.,student,3,0,,,,(يوك) ، لا.,"(Yuk), no."
"And put a piece there.  A piece there.  After you cut it, it’ll go right in.  Okay, you’re all done so you can start making these out of the cubes.  All right?",teacher,32,1,,,0.0,ووضع قطعة هناك، قطعة هناك، بعد أن تقطعها، ستدخل مباشرة. حسناً، انتهيت، لذا يمكنك البدء في صنع هذه من الكوبات، حسناً؟,"Okay, I'm done, so you can start making these cups, okay?"
[Inaudible],student,1,0,,,,[غير مسموع],[Unheard of]
Yep.  That one looks like it’s already made.,teacher,8,0,,,0.0,أجل، هذه تبدو وكأنها مصنوعة بالفعل.,"Yeah, this one looks like it's already made."
I can’t do this because I have sticking-up pieces.  It’s not gonna like let it go in perfectly.  It takes some [Inaudible].,student,22,0,,0.0,,لا أستطيع فعل هذا لأن لدي قطع متعلقة لن أحب أن أسمح لها بالدخول بشكل مثالي,I can't do this because I have pieces that I wouldn't want to let in perfectly.
"Yeah, you’re right.  We’re just gonna have to deal with that. Okay.  Okay.  We’re not doing any of that yet.  We’re making all the pieces first, okay?  Just make your pieces. You have one, two, three, four, five to make. You almost got it done?",teacher,45,0,1.0,,0.0,أجل، أنت محق، علينا أن نتعامل مع ذلك فقط، حسناً، حسناً، نحن لا نقوم بأي شيء من هذا بعد، نحن نقوم بإنشاء جميع الأجزاء أولاً، حسناً، فقط قم بإنشاء الأجزاء الخاصة بك، لديك واحد، اثنان، ثلاثة، أربعة، خمسة لتصنعها، هل انتهيت تقريباً؟,"Yeah, you're right, we just have to deal with that, well, well, we're not doing any of this anymore, we're creating all the parts first, well, just create your own parts, you have one, two, three, four, five to make, are you almost done?"
You do it every day.  You’re [Inaudible] like seconds. Who? You.,student,11,0,,0.0,,أنت تفعل ذلك كل يوم، أنت مثل الثانية.,"You do that every day, you're like a second."
How you coming along?  Looks like you’re almost ready.,teacher,9,0,0.0,,0.0,كيف حالك؟ يبدو أنك على وشك الاستعداد.,Looks like you're about to get ready.
[Inaudible],student,1,0,,,,[غير مسموع],[Unheard of]
Excellent.  Excellent.  I think just about everybody’s finished with their box. You don’t need this.  I’ll move this out of your way.  I’ll be right there.  This goes like this.  One little piece of tape.,teacher,35,0,,,0.0,ممتاز. ممتاز. أعتقد أن الجميع قد انتهوا من صناديقهم. أنت لا تحتاج إلى هذا. سأحرك هذا بعيداً عن طريقك. سأكون هناك. هذا يذهب هكذا. قطعة صغيرة من الشريط.,Excellent. Excellent. I think everybody's done with their boxes. You don't need this. I'll move this out of your way. I'll be there. This goes like this. a little piece of tape.
[Inaudible],student,1,0,,,,[غير مسموع],[Unheard of]
I know.  But the camera can’t see you here.  Okay.   Just the – I mean it’ll stay together if you just do one little piece of tape.  Okay?,teacher,28,0,,,0.0,أعلم، لكن الكاميرا لا تستطيع رؤيتك هنا، حسناً، أعني أنها ستبقى معًا إذا قمت بتصوير شريط صغير فقط، حسناً؟,"I know, but the camera can't see you here, well, I mean they'll stick together if you just shoot a little tape, okay?"
Where [Inaudible]?,student,2,0,,,,أين؟,Where?
Okay.  There’s no shape that looks like this.,teacher,8,0,,,0.0,حسناً، لا يوجد شكل يشبه هذا,"Well, there's no shape like this."
I know.,student,2,0,,,,-أعلم ذلك,-I know that
