text,speaker,talktime_words,math_density,uptake,student_reasoning,focusing_questions,text_arabic,text_back_translated
"So – wait.  No, no, no.  You have to make all of these.  Okay. We’re not testing quite yet.  We’re just making.  All right.",teacher,24,0,,,0.0,لا ، لا ، لا ، لا ، لا ، لا ، لا ، لا ، لا ، لا ، لا ، لا ، لا ، لا ، لا ، لا ، لا ، لا ، لا ، لا ، لا ، لا ، لا ، لا ، لا ، لا ، لا ، لا ، لا ، لا ، لا ، لا ، لا ، لا ، لا ، لا ، لا ، لا ، لا ، لا ، لا ، لا ، لا ، لا ، لا ، لا ، لا ، لا ، لا ، لا ، لا ، لا ، لا ، لا ، لا ، لا ، لا ، لا ، لا ، لا ، لا ، لا ، لا ، لا ، لا ، لا ، لا ، لا ، لا ، لا ، لا ، لا ، لا ، لا ، لا ، لا ، لا ، لا ، لا ، لا ، لا ، لا ، لا ، لا ، لا ، لا ، لا ، لا ، لا ، لا ، لا ، لا ، لا ، لا ، لا ، لا ، لا ، لا ، لا ، لا ، لا ، لا ، لا ، لا ، لا ، لا ، لا ، لا ، لا ، لا ، لا ، لا ، لا ، لا ، لا ، لا ، لا ، لا ، لا ، لا ، لا ، لا ، لا ، لا ، لا ، لا ، لا ، لا ، لا ، لا ، لا ، لا ، لا ، لا ، لا ، لا ، لا ، لا ، لا ، لا ، لا ، لا ، لا ، لا ، لا ، لا ، لا ، لا ، لا ، لا ، لا ، لا ، لا ، لا ، لا ، لا ، لا ، لا ، لا ، لا ، لا ، لا ، لا ، لا ، لا ، لا ، لا ، لا ، لا ، لا ، لا ، لا ، لا ، لا ، لا ، لا ، لا ، لا ، لا ، لا ، لا ، لا ، لا ، لا ، لا ، لا ، لا ، لا ، لا ، لا ، لا ، لا ، لا ، لا ، لا ، لا ، لا ، لا ، لا ، لا ، لا ، لا ، لا ، لا ، لا ، لا ، لا ، لا ، لا ، لا ، لا ، لا ، لا ، لا ، لا ، لا ، لا ، لا ، لا ، لا ، لا ، لا ، لا ، لا ، لا ، لا ، لا ، لا ، لا ، لا ، لا ، لا ، لا ، لا ، لا ، لا ، لا ، لا ، لا ، لا ، لا ، لا ، لا ، لا ، لا ، لا ، لا ، لا ، لا ، لا ، لا ، لا ، لا ، لا ، لا ،,"No, no, no, no, no, no, no, no, no, no, no, no, no, no, no, no, no, no, no, no, no, no, no, no, no, no, no, no, no, no, no, no, no, no, no, no, no, no, no, no, no, no, no, no, no, no, no, no, no, no, no, no, no, no, no, no, no, no, no, no, no, no, no, no"
We’re making –,student,3,0,,,,نحن نقوم بـ,We're doing the -
"Packages.  Okay.  Right.  One of each.  Hold on one second. Let me help these kids finish.  Have you cut out the other one there?  Oh, there it is over there.  Why did it get on his desk?",teacher,37,0,,,1.0,حسناً، حسناً، واحد من كلّ واحد، انتظر لحظة، دعني أساعد أولئك الأطفال على إنهاء، هل قطعتِ الآخر هناك؟ ها هو هناك، لماذا وصل إلى مكتبه؟,"Okay, well, one of each, wait a minute, let me help those kids finish, did you cut the other one over there?"
Are you supposed to make the [Inaudible]?,student,7,0,,,,هل من المفترض أن تجعل [الجهر]؟,Are you supposed to make [the virus]?
"No.  You’re supposed to – oh, I’m sorry.",teacher,8,0,1.0,,0.0,لا، من المفترض أن تفعل هذا أنا آسفة,"No, you're supposed to do this. I'm sorry."
[Inaudible] was doing something.,student,4,0,,,,كان يفعل شيئاً,He was doing something.
Yeah.  The packages that we had at the beginning.,teacher,9,0,,,0.0,نعم، الحزم التي كانت عندنا في البداية,"Yes, the packages we had in the beginning."
What was the plan [Inaudible]? How am I doing?,student,9,0,,0.0,,ما كانت الخطة؟ كيف حالي؟,What was the plan? how am I doing?
You’re doing okay.,teacher,3,0,1.0,,0.0,أنتِ بخير.,You're all right.
I would easily do it but I’m having a hard time with that [Inaudible].,student,14,0,,0.0,,كنت سأفعل ذلك بسهولة ولكنني أجد صعوبة في ذلك,"I would have done it easily, but I find it difficult."
Pass them to [Inaudible].  Just take one little piece and then we’re finished.,teacher,13,0,1.0,,0.0,فقط خذ قطعة صغيرة وحينها سننتهي,Just take a small piece and we'll be done.
I have tape [Inaudible].,student,4,0,,,,لدي شريط,I have a tape.
"Okay.  That’s good enough.  Now you want to start thinking about the packages.  Okay?  Right here.  Well, we can tape that afterwards.  Don’t worry about it.",teacher,26,0,,,0.0,حسناً، هذا جيد بما فيه الكفاية، الآن تريد أن تبدأ بالتفكير في الحزم، حسناً؟ هنا، حسناً، يمكننا تسجيل ذلك لاحقاً، لا تقلق بشأن ذلك.,"Well, that's good enough, now you want to start thinking about packages, okay? here, okay, we can record that later, don't worry about it."
I get it now.  So [Inaudible] supposed to try and find out how many –,student,15,0,,0.0,,فهمت الآن، لذا من المفترض أن نحاول معرفة كم ,"I get it now, so we're supposed to try to figure out how much."
Right.  But first of all you want to build A.  Okay?  So you know what it looks like.  Student D?,teacher,20,0,0.0,,0.0,حسناً، لكن أولاً تريد أن تبني (أ) حسناً، لذا تعرف كيف يبدو ذلك الطالب (د),"Okay, but first you want to adopt (a) Okay, so you know what that student (d) looks like"
Yes.,student,1,0,,,,-أجل، أجل,"- Yes, yes, yes"
"I asked nobody to write until I told you to do so. Okay?  And Student PJ, you didn’t hear me say that?",teacher,22,0,,,0.0,لم أطلب من أحد أن يكتب حتى أطلب منك أن تفعل ذلك,I never asked anyone to write until I asked you to.
No.  I just heard that you don’t [Inaudible]. Can I start it?,student,12,0,,0.0,,لا، لقد سمعت للتو أنكِ لا تسمعين، هل يمكنني البدء؟,"No, I just heard that you can't hear, can I start?"
"But I said that.  All right.  We’re gonna stop right now because people are at all different places.  So if everybody can five, four, three, two, cross their hands so we’re not touching anything.  Okay. We’re gonna go down to the first – most people almost have their box built.  Who again can remind us the dimensions? [Inaudible]?",teacher,58,1,1.0,,0.0,لكن قلت ذلك. حسناً. سنوقف الآن لأن الناس في كل أماكن مختلفة. إذاً إذا كان الجميع يستطيعون خمسة، أربعة، ثلاثة، اثنين، أن يتقاطعوا يديهما حتى لا نلمس أي شيء. حسناً. سنذهب لأول مرة,"But I said that. well. we'll stop now because people are in different places. so if everyone can have five, four, three, two, cross their hands so that we don't touch anything. well. we'll go for the first time."
It was six by four by three?,student,7,0,,,,كانت ستة على أربعة على ثلاثة؟,It was six on four on three?
"Six times four times three.  Did anybody calculate how many cubes that will hold?  A six by four?  [Inaudible], we’re still putting our hands like this.  Student J?",teacher,28,1,1.0,,0.0,ستة أضعاف أربعة أضعاف ثلاثة. هل أحسب أحدكم كم عدد الكوبات التي سوف تحمل؟ ستة أضعاف أربعة؟,Six times four times three. can any of you calculate how many cups you'll be able to hold? six times four?
72.,student,1,0,,,,72.,72.
"72.  Okay.  But we’re not putting in just 72 boxes today, cubes today, are we?  We want to see how many of the different packages.  So, I know everybody hasn’t finished their package A but you’ll have time to do that.  This is package A, right?",teacher,46,1,,,0.0,72. حسنا. ولكننا لن نضع فقط 72 صناديق اليوم، مكعبات اليوم، أليس كذلك؟ نحن نريد أن نرى كم من الحزم المختلفة. لذا، أنا أعرف أن الجميع لم ينهي حزمة A ولكن سيكون لديك الوقت للقيام بذلك. هذا حزمة A، أليس كذلك؟,"But we're not just going to put 72 boxes today, today's cubes, are we? we want to see how many different packages. so, I know that not everyone has finished package A but you'll have time to do so. that's package A, right?"
Yes.,student,1,0,,,,-أجل، أجل,"- Yes, yes, yes"
How many cubes in package A?,teacher,6,1,,,0.0,كم عدد الكوبات في الحزمة (أ) ؟,How many cups are in the package (a)?
"Six.   Wait up. Eight? No, eight.  Eight.",student,7,0,,,,ستة انتظر ثمانية لا ثمانية ثمانية,Six wait eight no eight eight eight
"Okay.  So your first thing was if you look down at the bottom, it says how many of each package will fit in box 1?  You all have your boxes.  How many of these do you think will fill in box 1?  Write your answer where it says first answer.   How many of these do you think will fit in box 1? Okay, we’re all doing this together right now.  Your first answer is your own personal answer.  How many you think.  You need to write it on the line.",teacher,90,1,0.0,,0.0,حسناً. إذاً أول شيء لديك إذا نظرت إلى الأسفل، فهو يقول كم من كل حزمة ستتناسب مع الصندوق الأول؟ جميعكم لديكم صناديقكم. كم من هذه تعتقدون أنها ستملأ الصندوق الأول؟ اكتبوا إجابتكم حيث تقول الجواب الأول. كم من هذه تعتقدون أنها ستتناسب مع الصندوق الأول؟ حسناً، نحن جميعاً نقوم بهذا معاً الآن. إجابتكم الأولى هي إجابتكم الشخصية. كم من هذه تعتقدون. يجب أن تكتبوها على الخط.,"So the first thing you have if you look down is how much of each package will fit the first box? You all have your own boxes. How many of these do you think will fill the first box? Write your answer where you say the first answer. How many of these do you think will fit the first box? Well, we all do this together now. Your first answer is your personal answer. How many of these do you think. You should write them on the line."
How many – [Inaudible] ones?,student,5,0,,,,كم عدد تلك التي لا يمكن سماعها؟,How many of those can't be heard?
Just A.  This is package A.  You are estimating or giving an answer of how many of these you think will fit in box 1.  I see Student N’s got it done.  I don’t see your answer.,teacher,37,1,0.0,,0.0,فقط A. هذا هو الحزمة A. كنت تقدير أو إعطاء إجابة عن كم من هذه تعتقد أنها ستتناسب في الصندوق 1. أرى طالب Ns حصلت عليه. أنا لا أرى إجابتك.,Just A. This is package A. You estimate or give an answer to how many of these you think will fit in box 1.I see a student Ns you got.I don't see your answer.
My answer’s right here.,student,4,0,,,,إجابتي هنا,My answer is here
"Okay.  I see your answer.  Okay.  Then, you’re going to test it.  You’re going to try it out to see how many fit.  Now, do you have to build all of them?  No.  You can.  But you can also do things like this. Okay?  So you shouldn’t do that before you do your estimate, however. Is everybody clear on what they’re gonna do?",teacher,63,1,,,0.0,حسناً. أرى إجابتك. حسناً. بعد ذلك، ستختبرينها. ستجربينها لمعرفة عدد الملائمين. الآن، هل يجب عليك بناء جميعها؟ لا. يمكنك. ولكن يمكنك أيضاً القيام بأشياء كهذه. حسناً؟ لذلك لا يجب عليك القيام بذلك قبل إجراء تقديرك.,"Okay. I see your answer. Okay. Then, you're going to test it. You're going to test it to see how many people fit. Now, should you build them all? No. You can. But you can also do things like this. Okay? So you don't have to do this before you make your estimate."
Yes. Yes. Yes.,student,3,0,,,,أجل، أجل، أجل,"Yes, yes, yes, yes."
"Okay.  So you’re gonna continue testing your answers.  Is this yours, Student PJ?",teacher,13,0,,,0.0,حسناً، ستستمر في اختبار إجاباتك هل هذا لك يا طالب بي جي؟,"Well, you will continue to test your answers, is this for you or for the student BJ?"
No.,student,1,0,,,,-كلا .,"- No , not at all ."
All right.,teacher,2,0,,,0.0,-حسناً,-Well then
Yeah.,student,1,0,,,,-أجل، أجل,"- Yes, yes, yes"
"So, do you guys need more cubes here?",teacher,8,1,,,0.0,إذاً، هل تحتاجون المزيد من الكوبات هنا؟,"So, do you need more cups here?"
I don’t know but I’m [Inaudible].,student,6,0,,,,أنا لا أعرف ولكن أنا [غير قابل للسمع].,I don't know but I am [inaudible].
Okay.,teacher,1,0,0.0,,0.0,-حسناً,-Well then
I’m done.,student,2,0,,,,لقد انتهيت,It's over now.
May I see B?  I’d like to see the 24 in here.,teacher,12,0,,,0.0,هل لي أن أرى ب؟ أود رؤية 24 هنا.,I'd like to see 24 here.
What’s C?,student,2,0,,,,ما هو (ج) ؟,What is c?
Okay.  So you fit.,teacher,4,0,,,0.0,حسناً، إذاً أنتِ مناسبة,"Well, then you're the right fit."
"One, two, three, four, five, six, seven, eight.  Eight.",student,9,0,,0.0,,واحد، اثنان، ثلاثة، أربعة، خمسة، ستة، سبعة، ثمانية.,"One, two, three, four, five, six, seven, eight."
Okay.  Great.  And this one?,teacher,5,0,0.0,,0.0,حسناً، عظيم، وهذه؟,"Well, great, and this one?"
"[That’s 12 by 18.] One, two, three, four, five, six.  Six times three equals 18.",student,15,0,,0.0,,واحد، اثنان، ثلاثة، أربعة، خمسة، ستة. ستة × ثلاثة يساوي 18.,"One, two, three, four, five, six."
Okay.  And D?,teacher,3,0,0.0,,0.0,حسناً، و (دي) ؟,"All right, and (D)?"
"Which one is D?  [Inaudible].  One, two, three, four.",student,9,0,,0.0,,أي واحد هو D؟ واحد، اثنان، ثلاثة، أربعة.,"Which one is D? One, two, three, four."
Okay.  And this one?,teacher,4,0,0.0,,0.0,حسناً، وهذه؟,"Well, what about this one?"
"E.  One, two, three, four, five, six, seven, eight, nine, ten, eleven.",student,12,0,,0.0,,واحد، اثنان، ثلاثة، أربعة، خمسة، ستة، سبعة، ثمانية، تسعة، عشرة، أحد عشر.,"One, two, three, four, five, six, seven, eight, nine, ten, eleven."
Okay.  All right.,teacher,3,0,0.0,,0.0,حسناً، حسناً,"All right, all right."
This is homework.  [Inaudible] that fit inside?,student,7,0,,,,هذه هي الواجبات المنزلية هل تتناسب بالداخل؟,"These are the homework, do they fit inside?"
Mm-hm.,teacher,1,0,0.0,,0.0,-حسناً,-Well then
[Inaudible],student,1,0,,,,[غير مسموع],[Unheard of]
Okay.,teacher,1,0,,,0.0,-حسناً,-Well then
This is [Inaudible]?,student,3,0,,,,هَلْ هَذَا [غير مُسمع]؟,Is this [unheard of]?
Right.  What we’re gonna go on to when you finish.,teacher,10,0,,,0.0,حسناً، ما سنقوم به عندما تنتهي,"Well, what are we going to do when it's over?"
"Yeah, I know that.",student,4,0,,,,نعم، أنا أعرف ذلك.,"Yes, I know that."
"Okay.  Let’s look at this one again, E.",teacher,8,0,,,0.0,حسناً، دعينا نلقي نظرة على هذه مرة أخرى يا (إي),"Well, let's take a look at this one again or (e) "
[Inaudible].  I just did this.  I saw [Inaudible].  Oh.  Yeah. 24.,student,11,0,,0.0,,(لا يمكن سماعها) ، لقد فعلت هذا للتو، رأيت (لا يمكن سماعها) ، أجل، 24.,"(Can't be heard), I just did this, I saw (can't be heard), yeah, 24."
24 fit in there?,teacher,4,0,1.0,,0.0,24 يتناسب هناك؟,Does 24 fit in there?
[Inaudible]  12.,student,2,0,,,,[غير مسموع] 12.,[Unheard of] 12.
Okay.  How we doing here?  Okay.  There’s nothing that big.,teacher,10,0,,,0.0,حسناً، كيف حالنا هنا؟ حسناً، لا يوجد شيء بهذا الحجم,"Well, there's nothing of this size."
I know.,student,2,0,,,,-أعلم ذلك,-I know that
"We’re using these packages, okay?  So you want to do your estimates right?",teacher,13,1,,,0.0,نحن نستخدم هذه الحزم، حسناً؟,"We're using these packages, all right?"
Mm-hm.,student,1,0,,,,-حسناً,-Well then
And then put them in.  What did you estimate for this one?  And what’d you find out?,teacher,17,1,,,1.0,ثم وضعتهم في. ما التقديرات لهذا واحد؟ وماذا وجدت؟,Then I put them in. What are the estimates for this one? and what did I find?
[Inaudible],student,1,0,,,,[غير مسموع],[Unheard of]
[Cause he could fit?],teacher,4,0,,,0.0,لأنه يمكن أن يناسب؟,Because it can fit?
Yeah.  I did standing up.,student,5,0,,,,أجل، لقد وقفت,"Yes, I stood up."
"Oh, you did standing up.",teacher,5,0,1.0,,0.0,لقد وقفت,I stood up.
Yes.  So this is [Inaudible] four.,student,6,0,,,,نعم، إذاً هذا هو الرابع.,"Yeah, so this is the fourth one."
"Okay.  Good.  All right.  So you’re on to C, right?   Good.",teacher,11,0,0.0,,0.0,"حسناً، حسناً، حسناً، إذاً أنتِ على ""ج""، صحيح؟","Well, well, well, well, then you're on ""C"", right?"
I’ll say C [Inaudible] 20.,student,5,0,,,,سَأَقُولُ C [غير مُسمع] 20.,I'm going to say C [inaudible] 20.
You say 20?,teacher,3,0,1.0,,0.0,هل قلت 20؟,Did I say 20?
Yeah.,student,1,0,,,,-أجل، أجل,"- Yes, yes, yes"
Okay.  Let’s see what B looks like.  How would you test it? This looks like B.  Right?  How would you test this in your box?  Okay.  So you can fit one there.,teacher,32,0,,,1.0,حسنا، دعونا نرى كيف تبدو B. كيف يمكنك اختبارها؟ هذا يبدو مثل B. صحيح؟ كيف يمكنك اختبار هذا في صندوقك؟ حسنا. حتى تتمكن من وضع واحد هناك.,"Okay, let's see what B looks like. How can you test it? This sounds like B. Right? How can you test this in your box? Okay. So you can put one there."
Six.  [Inaudible],student,2,0,,,,ستة. [غير مسموع],Six. [inaudible]
[Inaudible] Do you have to build them all to test it?,teacher,11,0,,,0.0,هل يجب عليك بناءهم جميعاً ليتم اختباره؟,Do you have to build them all to be tested?
"[Inaudible]  three, six, nine, one, three, six, seven, 14.",student,9,0,,0.0,,ثلاثة، ستة، تسعة، واحد، ثلاثة، ستة، سبعة، 14.,"Three, six, nine, one, three, six, seven, 14."
Okay.,teacher,1,0,0.0,,0.0,-حسناً,-Well then
"Well, it is 24.  So, first I’m gonna [Inaudible].  It’s 24.",student,11,0,,0.0,,حسناً، إنها 24، لذا أولاً سأذهب إلى (لا يمكن سماعها) إنها 24,"Well, it's 24, so first I'll go to (can't hear it) it's 24."
"Okay.  All right.  Make sure you do your first answer first and then try it out.  Good.  Okay, Student PJ, I’ll be right there.  Good.",teacher,25,0,0.0,,0.0,حسناً، حسناً، تأكد من إجابتك الأولى أولاً ثم جربها,"Well, well, make sure you get your first answer first and then try it."
Do you have more of this stupid paper?  Because I made mistakes.,student,12,0,,0.0,,هل لديك المزيد من هذه الورقة الغبية؟,Do you have any more of this stupid paper?
Yes.  Here.,teacher,2,0,1.0,,0.0,نعم، ها هي,"Yeah, yeah, yeah, yeah."
Thank you. Is this right?,student,5,0,,,,شكراً، هل هذا صحيح؟,"Thank you, is that right?"
That’s not one of the choices of packages.  We’re only doing these packages.,teacher,13,0,0.0,,0.0,هذه ليست واحدة من خيارات الحزم. نحن فقط نفعل هذه الحزم.,"This isn't one of the packaging options, we're just making these packages."
Why is hers so perfect? It’s not. I did mine by myself.  That’s why it’s so perfect.  Because I did mine by myself.  She helped you.,student,26,0,,0.0,,لمَ هي مثاليّة جداً؟ ليس كذلك، لقد فعلتها بنفسي، لهذا السبب هي مثاليّة جداً، لأنني فعلتها بنفسي، لقد ساعدتك.,"No, I did it myself, that's why it's so perfect, because I did it myself, I helped you."
Isn’t it [Inaudible]? Let’s take two of the prisms and draw the design on centimeter grid paper.  All right.,teacher,19,2,0.0,,0.0,دعونا نأخذ اثنين من المسامير ونرسم التصميم على ورقة شبكة سنتيمتر.,Let's take two nails and draw the design on a centimeter grid sheet.
[Inaudible]?,student,1,0,,,,[غير مسموع]؟,[Unheard of]?
Yes.,teacher,1,0,,,0.0,-أجل، أجل,"- Yes, yes, yes"
"Wait, when you do shapes –",student,6,0,,,,انتظر، عندما تفعل الأشكال,"Wait, wait, wait, wait, wait, wait, wait, wait, wait, wait, wait, wait, wait, wait, wait, wait, wait, wait, wait, wait, wait, wait, wait, wait, wait, wait, wait, wait, wait, wait, wait, wait."
Yeah.  The packages.  We call them packages.,teacher,7,0,0.0,,0.0,أجل، الحزم، نسميها حزم,"Yes, packages, we call them packages."
"The packages.  Like when you put one in, you know, a space, do you like put it again on top or –",student,22,0,,0.0,,الحزم. مثل عندما تضع واحدة في، كما تعلمون، مساحة، هل تحب وضعها مرة أخرى على أعلى أو ,"Packages. like when you put one in, you know, a space, do you like to put it back on top or ?"
"Well, what would happen if you did that?  Maybe you can borrow hers?  What would happen?",teacher,16,0,0.0,,1.0,حسناً، ماذا سيحدث لو فعلت ذلك، ربما يمكنك إقراضها؟,"Well, what would happen if I did, maybe you could borrow it?"
It’ll be too much.,student,4,0,,,,سيكون ذلك الكثير,That would be a lot.
"Too much, right.",teacher,3,0,,,0.0,الكثير، صحيح.,"A lot, that's right."
So like – and I’m on C right now.,student,9,0,,0.0,,لذا مثل  وأنا على C الآن.,So it's like I'm on C right now.
Okay.,teacher,1,0,0.0,,0.0,-حسناً,-Well then
"So, I was just wondering if it was fine if I just like stacked them up?",student,16,0,,0.0,,لذا، كنت أتساءل إن كان من الجيد لو قمت بتجميعها؟,"So, I was wondering if it would be a good idea if I put them together?"
"Right, right.  You could, couldn’t you?  Okay.  For this one, did you make your – did you make this one?",teacher,20,0,1.0,,0.0,صحيح، صحيح، يمكنك فعل ذلك، أليس كذلك؟ حسناً، لهذا، هل قمت بـ,"Right, right, you can do that, right?"
"Yeah.  A, right?",student,3,0,,,,أجل، أليس كذلك؟,"Yes, it is, isn't it?"
Yeah.  So it’s how many can you fit in?,teacher,9,0,,,0.0,أجل، إذاً كم عدد الأشخاص الذين يمكنك إدخالهم؟,"Yes, so how many people can you enter?"
Three.,student,1,0,,,,ثلاثة.,Three.
You can fit three?,teacher,4,0,,,0.0,هل يمكنك أن تستوعب ثلاثة؟,Can you accommodate three?
Three and another three.,student,4,0,,,,ثلاثة وثلاثة أخرى,Three and three more
Another three?  Or could you fit four?,teacher,7,0,,,0.0,ثلاثة آخرين، أو يمكنك أن تستوعب أربعة؟,"Three more, or can you accommodate four?"
Four?  Oh.,student,2,0,,,,أربعة؟,Four?
So how many could you fit on the bottom row?,teacher,10,0,,,0.0,إذاً كم عدد الأشخاص الذين يمكنك إدخالهم في الصف السفلي؟,So how many people can you put in the bottom row?
"Four.  So, eight.",student,3,0,,,,أربعة، ثم ثمانية.,"Four, then eight."
Eight.  And how many rows do you have?,teacher,8,0,,,0.0,ثمانية، وكم صف لديك؟,"Eight, and how many rows do you have?"
Six.,student,1,0,,,,ستة.,Six.
How many rows?,teacher,3,0,,,0.0,كم صف؟,How many rows?
"Oh, four.",student,2,0,,,,أربعة.,Four.
"Really?  How high is this box?  Are we looking at the same box here, Student A?",teacher,16,0,,,0.0,حقاً، كم ارتفاع هذا الصندوق؟ هل ننظر إلى نفس الصندوق هنا، الطالب أ؟,"Are we looking at the same box here, student A?"
"Oh, yeah, three I mean.",student,5,0,,,,أجل، ثلاثة أعني.,"Yeah, I mean three."
"Three.  Okay.  So if we have eight on the bottom and three, how many packages is that going to be?",teacher,20,0,1.0,,0.0,ثلاثة، حسناً، إذاً إن كان لدينا ثمانية في الأسفل وثلاثة، كم ستكون هذه الحزمة؟,"Three, well, so if we have eight at the bottom and three, how much will this package be?"
Teacher?,student,1,0,,,,أيها المعلم؟,"Teacher, what is it?"
One second.,teacher,2,0,,,0.0,لحظة واحدة.,Just one second.
"Wait.  So that means I can eight times three, right?  I’m getting confused now.",student,14,0,,0.0,,مهلاً، هذا يعني أنني أستطيع ثمانية مرات ثلاثة، صحيح؟,"Wait, that means I can do eight times three, right?"
Eight times three is a good start.  What’s eight times three?,teacher,11,0,1.0,,0.0,ثمانية × ثلاثة هو بداية جيدة. ما ثمانية × ثلاثة؟,Eight times three is a good start.What is eight times three?
