text,speaker,talktime_words,math_density,uptake,student_reasoning,focusing_questions,text_arabic,text_back_translated
It’s a – wait.  I keep forgetting.  Eight times what?,student,10,0,,0.0,,إنّه إنتظار، لا أزال أنسى، ثمانية مرات ماذا؟,"He waited, I still forget, eight times what?"
Three.,teacher,1,0,0.0,,0.0,ثلاثة.,Three.
"24, I mean, yeah.",student,4,0,,,,24، أعني، نعم.,"I mean, 24, yeah."
24.  Okay.  So do you see that 24 can fit?  You can fit eight on the bottom right?  Even if you had to make them.,teacher,25,0,,,0.0,24 حسناً، هل ترى أن 24 يمكن أن يناسبك؟ يمكنك أن تناسب ثمانية في الجزء السفلي على اليمين؟ حتى لو كان عليك أن تصنعها.,"24 Well, do you see that 24 can fit you? can you match an eight at the bottom right? even if you had to make it."
Is that B or A?,student,5,0,,,,"هل هذه ""ب"" أم ""أ""؟","Is that ""B"" or ""A""?"
That’s A.,teacher,2,0,1.0,,0.0,هذا هو A.,This is A.
A was [Inaudible].,student,3,0,,,,(أ) كان (لا يمكن سماعه),(a) was (cannot be heard)
I mean B.  That’s B.  A is that shape there.  Now let’s put A in and see what happens.  We can fit one there right?,teacher,25,0,,,0.0,أَعْني B. هذا B. A هو هذا الشكل هناك. الآن دعونا نَضْعُ A وَنَرى ما يَحْدثُ. نَستطيعُ أَنْ نَصْبِحَ واحداً هناك، حقّ؟,I mean B. This is B. A is this shape over there. Now let's put A and see what happens.
Mm-hm.,student,1,0,,,,-حسناً,-Well then
And one there.  And one there.,teacher,6,0,,,0.0,وواحد هناك وواحد هناك,And one over there and one over there.
Yeah.,student,1,0,,,,-أجل، أجل,"- Yes, yes, yes"
And one there.  So how many is that?,teacher,8,0,,,1.0,وواحد هناك. كم عدد ذلك؟,And one over there.How many is that?
Six.,student,1,0,,,,ستة.,Six.
Right.  Can we build another layer of A? Why?  What would happen?,teacher,12,0,,,1.0,صحيح، هل يمكننا بناء طبقة أخرى من A؟ لماذا؟ ماذا سيحدث؟,"Right, can we build another layer of A? Why? What will happen?"
Because the box is going to break.,student,7,0,,,,لأن الصندوق سيكسر,Because the box will break
The box – it would be too much.  Okay.  How is this group doing?,teacher,14,0,1.0,,1.0,الصندوق سيكون كثير جداً حسناً كيف حال هذه المجموعة؟,"The box will be too much. Okay, how's this group going?"
[Inaudible].,student,1,0,,,,[غير مسموع].,[Unheard of].
Okay.  You said you could only fit six in there?  Good.   What happens if you fit more in?,teacher,18,0,,,1.0,حسناً، قلت أنّه لا يمكن إدخال سوى ستّة أشخاص هناك؟,"Well, did you say that only six people can be admitted there?"
Fit what?,student,2,0,,,,تتناسب مع ماذا؟,Suitable for what?
"Like if you tried to put another row of A’s, what would happen? It would be too high, wouldn’t it?  Do you know what I mean?",teacher,26,0,,,0.0,مثل إذا حاولت وضع صف آخر من A ، ماذا سيحدث؟ سيكون مرتفعا جدا، أليس كذلك؟ هل تعرف ما أعنيه؟,"Like if I tried to put another row of A, what would happen? It would be too high, wouldn't it? You know what I mean?"
Mm-hm.,student,1,0,,,,-حسناً,-Well then
"Okay.  So now you’re ready to do B, right?  Have you named package B yet?",teacher,15,0,,,0.0,حسناً، الآن أنت جاهز للقيام بعمل (ب) ، صحيح؟ هل أسميت الحزمة (ب) بعد؟,"Well, now you're ready to do the job (b), right?"
Package B?,student,2,0,,,,الحزمة ب؟,Package B?
Package B looks like this.,teacher,5,0,,,0.0,الحزمة (ب) تبدو هكذا,Package (b) looks like this
"Oh.  Oh, that is easy.",student,5,0,,,,هذا سهل,That's easy.
So what do you think package B would be?,teacher,9,0,0.0,,1.0,إذاً ما الذي تعتقد أن الحزمة (ب) ستكون؟,So what do you think package (b) will be?
[Inaudible],student,1,0,,,,[غير مسموع],[Unheard of]
"How many package B’s do you think will fit in there?  Here’s a package B for you, all made.",teacher,19,0,,,0.0,كم حزمة ب تعتقد أنها ستتناسب هناك؟,How much package b do you think will fit in there?
"Oh, man.  I can’t [Inaudible].  So we’re trying to see how many B’s will fit in –",student,17,0,,0.0,,لا أستطيع، لذا نحن نحاول أن نرى كم من الـ (بي) ستتناسب,"I can't, so we're trying to figure out how many b's will fit."
Right.  How many you think?,teacher,5,0,1.0,,1.0,حسناً، كم تعتقدين منهم؟,"Well, how many do you think are there?"
24.,student,1,0,,,,24.,24. 24.
And what makes you think that?,teacher,6,0,,,1.0,و ما الذي يجعلك تعتقد ذلك؟,And what makes you think so?
"There’s 72 and [Inaudible]. Teacher, what do we do with [Inaudible]?",student,11,0,,0.0,,هناك 72 و [الجهاز غير السمعي] المعلم، ماذا نفعل مع [الجهاز غير السمعي]؟,"There are 72 and the teacher, what do we do with it?"
Okay.  Hm.,teacher,2,0,0.0,,0.0,حسناً.,All right.
And plus I tried it out.  Sorry.,student,7,0,,,,بالإضافة إلى أنني جربتها,"Besides, I've tried it myself."
"Okay, I see one, two, three, four.  I see 12.",teacher,10,0,0.0,,0.0,حسناً، أرى واحد، اثنان، ثلاثة، أربعة، أرى 12,"Well, I see one, two, three, four, I see twelve."
I know but then after what if there’s like four spots right here and –,student,15,0,,0.0,,أعرف ولكن بعد ذلك ماذا لو كان هناك مثل أربعة نقاط هنا و,But then I know what would happen if there were like four dots here and 
"I know.  Can we break the packages? You can’t like break the package.  Like this is like – like this could be a lamp or something.  You can’t break it to fit it in the box so you have to say how many of them fit without breaking them.  Maybe that wasn’t clear.  Oh, see.  It says that.  You may not break apart packages.",teacher,64,0,0.0,,0.0,أعرف. هل يمكننا كسر الحزمة؟ لا يمكنك أن تحب كسر الحزمة. مثل هذا هو مثل هذا يمكن أن يكون مصباح أو شيء من هذا القبيل. لا يمكنك كسرها لتناسبها في الصندوق لذلك يجب عليك أن تقول كم منها تناسب دون كسرها. ربما لم يكن ذلك واضحا. أوه، انظر. يقول ذلك. قد لا تقطع الحزمة.,"I know. can we break the package? you can't like to break the package. like this is like this can be a lamp or something like that. you can't break it to fit in the box so you have to say how many of them fit without breaking it. maybe it wasn't clear. oh, look. he says that. you may not break the package."
[So only about 14 I would say.],student,7,0,,,,[إذن فقط حوالي 14 أود أن أقول.],[So only about 14 I'd like to say.]
Show me the 14.  I don’t see that.,teacher,8,0,1.0,,0.0,أرني الأربعة عشر لا أرى ذلك,"Show me the fourteen, I don't see that."
"Oh, so we’re not supposed to do this or something?",student,10,0,,0.0,,إذن ليس من المفترض أن نفعل هذا أو شيء من هذا القبيل؟,So aren't we supposed to do this or something like that?
And that’s – can you fit a package going that way?,teacher,11,0,0.0,,0.0,وهذا هو هل يمكنك وضع حزمة تذهب في هذا الاتجاه؟,"And that is, can you put a package that goes in that direction?"
No.,student,1,0,,,,-كلا .,"- No , not at all ."
No.,teacher,1,0,,,0.0,-كلا .,"- No , not at all ."
So it’s 12.,student,3,0,,,,لذا فهو 12,So it is 12.
"Okay.  All right.  When you go on further, you’re gonna go to this [Inaudible].  Because these are the pages of [Inaudible].",teacher,21,0,,,0.0,"حسناً، حسناً، عندما تذهب إلى أبعد، ستذهب إلى هذا، لأن هذه صفحة ""الجهل"".","Well, well, when you go further, you'll go to this, because this is the ""ignorance"" page."
So go ahead?,student,3,0,,,,إذاً إذهبوا؟,So you're going?
Yep.  And see what [we hear].  Okay.  And then we’re gonna come together in a few minutes.,teacher,17,0,,,0.0,أجل، وسنرى ماذا سنسمع، حسناً، وسنلتقي بعد بضع دقائق,"Yeah, and we'll see what we hear, okay, and I'll see you in a few minutes."
Okay.,student,1,0,,,,-حسناً,-Well then
All right.,teacher,2,0,,,0.0,-حسناً,-Well then
Yeah.,student,1,0,,,,-أجل، أجل,"- Yes, yes, yes"
After everybody gets their packages all done.,teacher,7,0,,,0.0,بعد أن ينهي الجميع حزمهم,After everyone has finished their packages.
Okay.  [Inaudible] I can’t get that one page.,student,8,0,,0.0,,حسناً، لا أستطيع الحصول على صفحة واحدة,"Well, I can't get a single page."
You know what?  Build one and then I’ll give you more.  Okay?,teacher,12,0,1.0,,0.0,إبنوا واحداً ثم سأعطيك المزيد، حسناً؟,"Build one and I'll give you more, okay?"
90.  Yay! Think of it.  90.,student,6,0,,,,تفكر بالأمر,Think about it.
"Huh.  I want to ask you how you got 14 in here.  Can you show me? What do you think now?  Okay.  Same with you.  Student D, I noticed you thought you could fit 14 of these.  You can only fit four in the bottom, right?  Because we can’t break the package.",teacher,52,0,0.0,,0.0,أريد أن أسألك كيف حصلت على 14 هنا، هل يمكنك أن تريني؟ ما رأيك الآن؟ حسناً. نفس الشيء معك. الطالب د، لاحظت أنك تعتقد أنك يمكن أن تستوعب 14 من هذه. يمكنك أن تستوعب أربعة فقط في الأسفل، أليس كذلك؟ لأننا لا يمكننا كسر الحزمة.,"I want to ask you how you got 14 here, can you show me what you think now? OK. Same thing with you. Student D, I noticed that you think you can accommodate 14 of these. You can only accommodate four down here, right? because we can't break the package."
Oh.,student,1,0,,,,-أوه .,-Oh .
"So it’s one, two, three, four, five, six, seven, eight, nine, ten, 11.",teacher,13,0,,,0.0,لذا هو واحد، اثنان، ثلاثة، أربعة، خمسة، ستة، سبعة، ثمانية، تسعة، عشرة، 11.,"So it is one, two, three, four, five, six, seven, eight, nine, ten, 11."
Twelve.,student,1,0,,,,اثني عشر,There are twelve.
"You can’t fit them there [Inaudible].  Student J, I need to see how you figured that out.",teacher,17,0,,,1.0,لا يمكنك إدخالها هناك (لا يمكن سماعها) الطالب (جاي) ، أريد أن أرى كيف فهمت ذلك,"You can't put it in there (can't hear it) the student (Jay), I want to see how you get it."
I told you.,student,3,0,,,,لقد اخبرتك,I told you.
"We’re gonna come together.  Okay? Yeah.  You can build those, try to build ‘em.  You know what, Student J?  That is totally uncalled for.  What?  No, we’re doing centimeter [Inaudible].  Student J?",teacher,32,1,,,0.0,سنأتي معاً، حسناً؟ نعم، يمكنك بناء هذه، حاول بناءها. أتعلمين ماذا، الطالب جي؟ هذا غير مرغوب فيه تماماً. ماذا؟ لا، نحن نقوم بالسينتيمتر. الطالب جي؟,"Yeah, you can build this one, try to build it. You know what, student J? That's totally undesirable. What? No, we're doing centimeters. student J?"
He just told me that I can’t [Inaudible] [black up.],student,10,0,,0.0,,لقد أخبرني للتو أنّي لا أستطيع أن أظلم,He just told me that I can't be dark.
You know what?  I don’t know why you went over there but if you’re trying to cause trouble –,teacher,19,0,0.0,,0.0,لا أعرف لماذا ذهبت إلى هناك ولكن إذا كنت تحاول أن تسبب المشاكل,I don't know why you went there but if you were trying to cause trouble
[Inaudible],student,1,0,,,,[غير مسموع],[Unheard of]
"– you are.  Especially for someone who’s – I’m gonna talk to their mom today.  And you want to do this?  Yes.  I’m calling her right at lunchtime because you asked me to. So, what do you want me to tell her?  All right.",teacher,44,0,,,0.0,نعم انا اتصل بها في وقت الغداء لانك طلبت مني لذلك ماذا تريدني ان اقول لها؟ حسناً,"Yes, I called her at lunchtime because she asked me to, so what do you want me to say to her?"
"All right, all right.  I’ll [Inaudible].  I said, “I’m not.  [I got C4].”  And he was like –",student,18,0,,0.0,,"حسناً، حسناً. سأفعل ذلك. قلت، ""ليس كذلك"".","All right, all right. I'm going to do it. I said, ""No, it's not""."
Okay.  There you go.,teacher,4,0,0.0,,0.0,حسناً، ها أنت ذا,"Well, there you are."
Okay.,student,1,0,,,,-حسناً,-Well then
Do you want to try to make one?  Of those?,teacher,10,0,,,0.0,هل تريد محاولة صنع واحدة من هذه؟,Would you like to try making one of these?
I only got three right. Teacher?,student,6,0,,,,أنا فقط حصلت على ثلاثة الحق، المعلم؟,"I just got three, right, teacher?"
You mean your first answer?  Yeah.  Okay.  In about three minutes – how many people have tested all of them?  Okay. How many people are almost finished?  Okay.  Yes.,teacher,29,0,0.0,,0.0,هل تعني الإجابة الأولى؟ نعم. حسناً. في حوالي ثلاث دقائق كم عدد الأشخاص الذين اختبروا جميعهم؟ حسناً. كم عدد الأشخاص الذين كانوا على وشك الانتهاء؟ حسناً. نعم.,Do you mean the first answer? yes. well. in about three minutes how many people have tried all of them? well. how many people were about to finish? well. yeah.
"Now, when you put these in, can you stack ‘em on top of each other?",student,15,0,,0.0,,الآن، عندما تضع هذه في، هل يمكنك وضعها فوق بعضها البعض؟,"Now, when you put these in, can you put them on top of each other?"
Yeah.  You can stack ‘em on top.  It’s just they can’t go outside the box.,teacher,15,0,1.0,,0.0,أجل، يمكنك أن تضعهم فوق، لكنّهم لا يستطيعون الخروج من الصندوق,"Yes, you can put them on top, but they can't get out of the box."
Can they go like that?,student,5,0,,,,هل يمكنهم الذهاب هكذا؟,Can they go like this?
"That’s not outside the box, is it?",teacher,7,0,0.0,,0.0,هذا ليس خارج الصندوق، أليس كذلك؟,"That's not out of the box, is it?"
No.,student,1,0,,,,-كلا .,"- No , not at all ."
"So you think they’re up three high, right?",teacher,8,0,,,0.0,إذاً تعتقد أنهم صعدوا ثلاثة أعلى، صحيح؟,"So you think they climbed three higher, don't you?"
[Inaudible],student,1,0,,,,[غير مسموع],[Unheard of]
"Oh, there’s no more graph paper.  I’ll have to get some more. I can get some more for you. Okay.  Okay.  Let’s talk a little bit about back to these and the packages.  When you guys put 14 here, did you do that by you think you could break the package?  Or what were you guys really thinking?",teacher,58,1,,,1.0,لا يوجد المزيد من الورق الرسمي. يجب أن أحصل على المزيد. يمكنني الحصول على المزيد لكم. حسناً. حسناً. دعونا نتحدث قليلاً عن هذه والحزم. عندما وضعتم 14 هنا، هل فعلتم ذلك من خلال أن كنتم تعتقدون أنكم يمكنكم كسر الحزمة؟ أو ماذا كنتم تفكرون حقاً؟,"There's no more paperwork. I need to get more. I can get more for you. Okay. Okay. Okay. Let's talk a little bit about this and the packages. When you put 14 here, did you do it by thinking you could break the package? or what were you really thinking?"
"You gotta be kidding me, dude. What?  I never actually did it [Inaudible] middle.",student,14,0,,0.0,,لا بدّ أنّكِ تمزحين معي يا صاح، لم أفعل ذلك أبداً,"You got to be kidding me, dude, I never did that."
"Well, he [Inaudible]",teacher,3,0,1.0,,0.0,حسناً، هو [غير مُسمع],"Well, it is [unheard of]"
He said the actual [Inaudible] is three. I don’t know. So let me repackage it.,student,15,0,,0.0,,قال أن الصوت الحقيقي ثلاثة، لا أعرف، لذا دعيني أعيد تعبئةها.,"He said the real sound was three, I don't know, so let me refill it."
"Let’s look at the package right here.  Okay?  Student E? Student E?  Look at me.  Okay.  This is the package, right? If I’m fitting it into the box they have to all fit.  So I can put one there, one there, one there, right?  That’s three.  I can fit one there, one there, one there.  So the actual answer is?",teacher,60,0,1.0,,0.0,دعونا نلقي نظرة على الحزمة هنا. حسنا؟ الطالب E؟ الطالب E؟ انظر إلي. حسنا. هذه هي الحزمة، أليس كذلك؟ إذا كنت أضعها في الصندوق يجب أن تناسبها جميعها. لذلك يمكنني وضع واحد هناك، واحد هناك، واحد هناك، أليس كذلك؟ هذا هو ثلاثة. يمكنني وضع واحد هناك، واحد هناك، واحد هناك. لذلك الجواب الحقيقي هو؟,"Let's take a look at the package here. Okay? Student E? Student E? Look at me. Okay. This is the package, right? If I put it in the box, it should fit all of them. So I can put one over there, one over there, one over there, right? That's three. I can put one over there, one over there, one over there. So the real answer is?"
Six.,student,1,0,,,,ستة.,Six.
Six.  Right.,teacher,2,0,,,0.0,ستة، صحيح.,"Six, that's right."
"Oh, he was on B.  That’s why. You told B so that’s why I said 24.",student,16,0,,0.0,,"لقد كان على ""ب"" لهذا أخبرت ""ب"" لذلك قلت ""24""","It was on ""B"" so I said ""B"" so I said ""24""."
Okay.  All right.  So –,teacher,5,0,0.0,,0.0,حسناً، حسناً,"All right, all right."
B.  You need to create –,student,6,0,,,,ب. تحتاج إلى إنشاء ,B. you need to create 
"Now this is package B.  I can fit one, right?  Two, three, four, five, six, seven, eight.  And then can I create other layers of eight?",teacher,26,0,1.0,,0.0,الآن هذه هي الحزمة ب. يمكنني أن أضع واحدة، صحيح؟ اثنان، ثلاثة، أربعة، خمسة، ستة، سبعة، ثمانية. وبعد ذلك يمكنني أن أخلق طبقات أخرى من ثمانية؟,"Now this is package B. Can I put one, right? two, three, four, five, six, seven, eight."
Yes.,student,1,0,,,,-أجل، أجل,"- Yes, yes, yes"
How many layers of eight?,teacher,5,0,,,0.0,كم طبقة من ثمانية؟,How many classes of eight?
Three.,student,1,0,,,,ثلاثة.,Three.
"Okay.  So, what’s eight times three?",teacher,6,0,,,0.0,حسناً، ما هو ثمانية مرات ثلاثة؟,"Well, what is eight times three?"
Four.,student,1,0,,,,أربعة.,Four.
"Right.  But you wanted to make an estimate first.  And that’s all right because we didn’t do that.  Okay.  So, C.  Now you’re to package C.  Now, do you know what you have to do? Okay.",teacher,36,1,,,0.0,حسناً، لكنّكِ أردتِ التقدير أولاً، وهذا جيد لأنّنا لم نفعل ذلك. حسناً، (ج) الآن أنتِ ستغلفين (ج) الآن، هل تعرفي ما عليكِ فعله؟ حسناً.,"Okay, but you wanted the appreciation first, and that's good because we didn't. (c) Now you're going to wrap up (c) Now you know what to do?"
"Yeah.  A, B, C and D.",student,6,0,,,,نعم، أ، ب، ج و د.,"Yes, A, B, J and D."
You’re a nice helper.,teacher,4,0,0.0,,0.0,أنت مساعدة لطيفة,You're a nice help
Uh-huh.,student,1,0,,,,اه-ها.,Ah-ha. 
Okay.  Have you done your actual yet for everything?,teacher,9,0,,,0.0,حسناً، هل قمت بالعمل الحقيقي الخاص بك بعد؟,"Well, have you done your real work yet?"
I just gotta write down –,student,6,0,,,,يجب أن أكتب فقط,All I have to do is write.
Okay.,teacher,1,0,1.0,,0.0,-حسناً,-Well then
[Inaudible],student,1,0,,,,[غير مسموع],[Unheard of]
"Okay.  Okay.  Is that the best way to put it in? You can.  Okay.  We’re gonna stop now no matter where people are. You do like this, can’t you fit more?  If you go this way?",teacher,36,0,,,0.0,حسناً، حسناً، هل هذه أفضل طريقة لإدخالها؟ يمكنك ذلك. حسناً، سنوقف الآن بغض النظر عن مكان وجود الناس.,"Well, well, is this the best way to introduce it? you can. well, we'll stop now no matter where people are."
Yes.,student,1,0,,,,-أجل، أجل,"- Yes, yes, yes"
Three and three.  Okay.  All right.  Give them to her.  She’ll manage them.,teacher,13,0,,,0.0,ثلاثة وثلاثة، حسناً، أعطها إياها، ستديرها,"Three and three, well, give it to her, she'll turn it."
I was gonna throw them away.,student,6,0,,,,كنت سأرميهم بعيداً,I would have thrown them away.
Are you done?,teacher,3,0,0.0,,0.0,هل انتهيت؟,Are you done?
No. Yeah. He finished. What are we supposed to be doing?,student,11,0,,0.0,,كلا، لقد أنهى، ماذا يفترض أن نفعل؟,"No, it's over, what are we supposed to do?"
All right.,teacher,2,0,0.0,,0.0,-حسناً,-Well then
A lot of things.,student,4,0,,,,الكثير من الأشياء,A lot of things.
"All right, boys and girls, five, four, three, two, one.  Many people are finished.  If you’re not finished, that’s okay.",teacher,20,0,,,0.0,حسناً، الفتيان والفتيات، خمسة، أربعة، ثلاثة، اثنان، واحد. الكثير من الناس قد انتهوا. إذا لم تنتهوا، لا بأس.,"Well, boys and girls, five, four, three, two, one. A lot of people are done."
With the first page?,student,4,0,,,,مع الصفحة الأولى؟,With the front page?
Many people are finished with the first activity.  Some of you went on to looking at making the prisms.  I want to talk about the first activity as a class. But people need to stop with the blocks.  Need to put their hands like this and face me.  Thank you.  That means you’re not gonna go back in two seconds and start touching the packages again.  All right?  ‘Cause we’re gonna go over some of what was going on here today. Okay.  We built a box.  What were the dimensions of the box?  Raise your hand if you know.  Okay.  Student J?,teacher,102,2,,,0.0,الكثير من الناس انتهوا من النشاط الأول. بعضكم ذهب إلى النظر في صنع المرافق. أريد أن أتحدث عن النشاط الأول كصف. ولكن الناس بحاجة إلى التوقف عن الكتل. تحتاج إلى وضع يدي مثل هذا وجها لي. شكراً. هذا يعني أنك لن تعود بعد ثواني و تبدأ بمس الحزم مرة أخرى. حسناً؟ لأننا سوف نقوم بمراجعة بعض ما كان يحدث هنا اليوم. حسناً. قمنا ببناء صندوق. ما هي أبعاد الصندوق؟ رفع يدك إذا كنت تعرف. حسناً. الطالب J,A lot of people have finished the first activity. Some of you went to consider building facilities. I want to talk about the first activity as a class. But people need to stop blocks. You need to put my hand like this in front of me. Thank you. That means you won't be back in seconds and start touching the packages again. Okay? Because we're going to review some of what was happening here today. Okay. We built a box. What are the dimensions of the box? raise your hand if you know. Okay. Student
[Inaudible],student,1,0,,,,[غير مسموع],[Unheard of]
"Okay.  Six by four by three.  And I think Student J, you told us how many cubes?",teacher,17,1,,,0.0,حسناً، ستة على أربعة على ثلاثة، وأعتقد أن الطالب (جي) أخبرنا كم عدد الكوبات؟,"Well, six on four on three, and I think the student (s) told us how many cups?"
About 72.,student,2,0,,,,حوالي 72.,About 72.
"72.  So.  Now we had some packages, right? And we said this was how many?",teacher,15,0,,,0.0,إذاً، كان لدينا بعض الحزم، صحيح؟,"So, we had some packages, didn't we?"
Eight.,student,1,0,,,,ثمانية,Eight eight eight eight eight eight eight eight eight eight eight eight eight eight eight eight eight eight eight eight eight eight eight eight eight eight eight
Eight.  Did anybody think you could fit nine of these in the box?,teacher,13,0,,,1.0,هَلْ يَعتقدُ أَحَدٌ أَنَّك يُمْكِنُ أَنْ تَصْبِحَ تسعة مِنْ هذه في الصندوقِ؟,Does anyone think you can make nine of these in a box?
Yes.,student,1,0,,,,-أجل، أجل,"- Yes, yes, yes"
"What made you think that, Student J?",teacher,7,0,,,1.0,ما الذي جعلك تعتقد ذلك، الطالب جي؟,"What made you think that, student J?"
[Inaudible],student,1,0,,,,[غير مسموع],[Unheard of]
Student E?,teacher,2,0,,,0.0,الطالب (إي) ؟,The student (e) ?
I thought eight times nine.,student,5,0,,,,فكرت في ثمانية مرات تسعة.,I've thought about eight times nine.
