text,speaker,talktime_words,math_density,uptake,student_reasoning,focusing_questions,text_arabic,text_back_translated
"No.  Right? But what I want to double-check is to make sure that my stops are accurate. So everybody take their rulers now, everybody take their rulers and we’re going to measure.  And what should we notice? Let’s think about it.  Let’s make a prediction. What do you think the distance from zero halves to one-half is going to be? Student K? Let’s make a prediction.  How far do you think this first stop will be from zero halves to one half? Student T?",teacher,84,4,,,0.0,لا. صحيح؟ ولكن ما أريد التحقق منه هو التأكد من أن توقفاتي دقيقة. لذا كل شخص يأخذ حكامه الآن، كل شخص يأخذ حكامه ونحن سنقيس. وماذا يجب أن نلاحظ؟ دعونا نفكر في ذلك. دعونا نقوم بتنبؤ. ما هو المسافة التي تعتقد أنها ستكون من صفر نصف إلى نصف؟ الطالب K؟ دعونا نقوم بتنبؤ. كم تعتقد أن هذه المحطة الأولى ستكون من صفر نصف إلى نصف؟ الطالب T؟,"But what I want to verify is to make sure that my stops are accurate. So everyone takes his judgment now, everyone takes his judgment while we measure. And what should we notice? Let's think about it. Let's predict. What distance do you think will be from zero and a half to half? Student K? Let's predict. How much do you think this first stop will be from zero and a half to half? Student T?"
"It’s a half, or it could be called 50 percent.",student,10,1,,0.0,,إنه نصف، أو يمكن أن نسميه 50 في المئة.,"It's half, or we could call it 50 percent."
"Okay, but do you think it’s going to be the same amount as it will be from one-half to one-whole?",teacher,20,1,1.0,,0.0,حسناً، لكن هل تعتقد أنه سيكون نفس المبلغ كما سيكون من نصف إلى واحد كامل؟,"Okay, but do you think it will be the same amount as half to one full?"
Yes.,multiple students,1,0,,,,-أجل، أجل,"- Yes, yes, yes"
"Right.  And that’s where this ruler comes in, and that’s where our double-checking will come into play. So everybody take their rulers now.  How many inches is it from zero halves to one-half? Hands up.",teacher,35,2,,,0.0,صحيح. وهذا هو المكان الذي يأتي فيه هذا الحاكم، وهذا هو المكان الذي يبدأ فيه التحقق المزدوج لدينا. لذلك الجميع يأخذ الحاكم الخاص بهم الآن. كم بوصة هو من صفر نصف إلى نصف؟ ارفع يديك.,"That's right. and that's where this governor comes in, and that's where our double-checking begins. so everyone takes their governor now. how many inches is from zero and a half to half? raise your hands."
In inches or …,student,4,0,,,,في بوصات أو ...,In inches or ...
Let’s do inches.  Student C?,teacher,5,0,,,0.0,دعونا نفعل بوصات الطالب (سي) ؟,Let's do the student thumbs up?
Four.,student,1,0,,,,أربعة.,Four.
"Four.  Now, Student C, let’s double-check the next stop.  Is it four inches from one-half to one-whole?",teacher,17,1,,,0.0,أربعة، الآن، الطالب سي، دعونا نتحقق من المحطة التالية. هل هو أربعة بوصات من نصف إلى واحد كامل؟,"Four, now, student C, let's check the next station. is it four inches from half to one full?"
"Yes, it is.",student,3,0,,,,-أجل، إنه كذلك,"-Yes, it is."
"Right.  So then Student C would say, “I have successfully finished this fraction track.”  Then, up here if you see on the white board, I’ve labeled to make it easier for you so we don’t forget any, all the fractions that need to be on this track.  So Miss H could say, “This track is done.” Then I would move on to my next track, to the thirds track. So this is kind of your guidance to make sure you don’t forget any stops, okay? So the next step is you’re going to go down to the thirds track, and this is where you’re going to work with your partners. Make sure that from each space in between zero thirds to one-third is the same, one-third to two-thirds, then two- thirds to three-thirds are all equal.  Also, don’t forget, some of them are already marked on there for you.  So some of the stops are already there.  And use what you know of the equivalent percents in fractions to help you fill in more than one at a time, just like we did with the halves. We knew that one-half was also equal to two-fourths, three- sixths, four-eighths and five-tenths.  So when we were filling out our half stop, we could fill out other ones as well.  So use what you know of equivalent percents in fractions to help you out.  Okay? So now what you’re going to be doing, Student A, is you’re going to be working with your table partner to fill in the rest of your tracks. Make sure you use your ruler and your background knowledge, okay? I will be coming around to each group to check to make sure you’re on the right track, okay? Also, be ready to share some of your strategies on how you filled out this fraction track.  Come on girls, how come you don’t have those filled out? We did those together. So did you double-check and measure?",teacher,328,12,,,0.0,حسناً. إذاً فإن الطالب (ج) سيقول: لقد أنهيت بنجاح هذه المسارة الكسرية، حسناً؟ إذاً، إذاً، إذاً إذا رأيت على اللوحة البيضاء، سأضع علامة لتسهيل الأمر بالنسبة لك حتى لا ننسى أي منها، جميع الكسائر التي تحتاج إلى أن تكون على هذه المسارة. لذا يمكن أن تقول الآنسة (ه) ، هذا المسار قد تم. ثم سأنتقل إلى مسارتي التالي، إلى مسار الثلثات. إذاً، هذه نوع من الإرشادات الخاصة بك للتأكد من عدم نسيان أي توقفات، حسناً؟ إذاً، الخطوة التالية هي أنك ستذهب إلى أسفل إلى الثلثات، وهذا هو المكان الذي ستعمل فيه مع شركائك. تأكد من أن كل مساحة بين صفر إلى ثلث واحد هي نفس المسار، ثلث واحد إلى ثلث واحد.,"So, then, if you see on the whiteboard, I'll put a sign to make it easier for you so that we don't forget any of them, all the breaks that need to be on this path. So you can say Miss (h), this path has been completed. Then I'll move on to my next path, the path of thirds."
"Yeah, the way we did the first one is we measured the distance in here and it was … 7 centimeters. Yeah, 7 centimeters.  And then we did the same thing over here and it was 7 centimeters.",student,38,5,,0.0,,نعم، الطريقة التي قمنا بها في الأولى هي قياس المسافة هنا وكانت 7 سنتيمترات نعم، 7 سنتيمترات ثم فعلنا نفس الشيء هنا وكانت 7 سنتيمترات,"Yes, the way we did it in the first one was to measure the distance here and it was 7 centimetres yes, 7 centimetres then we did the same thing here and it was 7 centimetres"
"Okay, and was it 7 centimeters also between one-third and two- thirds?",teacher,12,1,1.0,,0.0,حسناً، وهل كانت 7 سنتيمتر أيضاً بين ثلثي و ثلثي؟,"Well, was there also 7 centimeters between two-thirds and two-thirds?"
Uh-huh.  That’s why we put 7 centimeters.  See? That’s 7 centimeters.  And then you go over here and it’s 7 centimeters.,student,21,3,,0.0,,لهذا وضعنا سبعة سنتيمترات، هذا سبعة سنتيمترات، ثم تذهب إلى هنا وتجد سبعة سنتيمترات.,"That's why we put seven centimeters, this is seven centimeters, and then you go over here and find seven centimeters."
"Good, all right.",teacher,3,0,0.0,,0.0,حسناً، حسناً,"All right, all right."
These ones are confusing.,student,4,0,,,,هذه الخلطات,These are mixtures.
"Okay, so the next one you’re going to do is the thirds track, right? So looking at our fraction here, how many equal groups do we need to break this track into? How many stops are we going to have?",teacher,40,2,,,0.0,حسناً، إذاً التالي الذي ستقوم به هو مسار الثالث، صحيح؟ إذاً بالنظر إلى جزءنا هنا، كم مجموعة متساوية نحتاجها لقطع هذا المسار؟ كم توقف سنحصل عليه؟,"So considering our part here, how many equal sets do we need to cut this path? How many stops will we get?"
Three.,student,1,0,,,,ثلاثة.,Three.
Right.  And what told us that?,teacher,6,0,,,1.0,صحيح، وما الذي أخبرنا بذلك؟,"That's right, and why did he tell us that?"
"Because one stop here, one stop here, and one stop here.",student,11,0,,1.0,,لأنه توقف واحد هنا، توقف واحد هنا، ووقف واحد هنا.,"Because one stop here, one stop here, and one stop here."
"Okay, so what tells us how many groups we’re going to have in total?",teacher,14,1,0.0,,1.0,حسناً، ما الذي يخبرنا عن عدد مجموعاتنا الإجمالية؟,"Well, what tells us about the total number of our sets?"
Three.,student,1,0,,,,ثلاثة.,Three.
What’s telling us that?,teacher,4,0,,,1.0,ما الذي يخبرنا بذلك؟,What tells us that?
The first one.,student,3,0,,,,الأولى.,The first one.
"Look at this fraction, what tells you.  Zero tells you how many stops there are going to be?",teacher,18,1,,,0.0,انظر إلى هذا الجزء، ما الذي يخبرك؟ صفر يخبرك كم توقف سيكون هناك؟,"Look at this section, what tells you? 0 tells you how many stops there will be?"
Three.,student,1,0,,,,ثلاثة.,Three.
"Three.  Because remember, the denominator tells you how many groups you’re going to have altogether, right? So we know that this track is going to have three stops.  So far we only have one stop, from here to here, so we need to add in the next stop.  So we need to figure out where we’re going to put one-third, right? So what could you measure on here that would help tell you the measurement for the next stop? Because each stop has to be what?",teacher,86,4,,,0.0,ثلاثة. لأن تذكر، القاسم يخبرك كم المجموعات التي سوف يكون لديك، صحيح؟ لذلك نحن نعلم أن هذا المسار سوف يكون ثلاثة توقف. حتى الآن لدينا توقف واحد فقط، من هنا إلى هنا، لذلك نحن بحاجة إلى إضافة في المحطة التالية. لذلك نحن بحاجة إلى معرفة أين سوف نضع الثلث، أليس كذلك؟ لذلك ما الذي يمكن قياس هنا الذي سيساعدك على معرفة قياس المحطة التالية؟ لأن كل محطة يجب أن يكون ما؟,"So we know that this path will be three stops. So far we have only one stop, from here to here, so we need to add in the next stop. So we need to know where we will put the third, right?"
Four inches?,student,2,0,,,,أربعة بوصات؟,Four inches?
It doesn’t have to be four inches.  That was on the halves one. But what did you know about each stop? This was four inches and this was four inches.  So they need to be what?,teacher,36,0,,,0.0,ليس من الضروري أن يكون أربعة بوصات. كان ذلك في نصف واحد. ولكن ماذا كنت تعرف عن كل محطة؟ هذا كان أربعة بوصات وهذه كانت أربعة بوصات. لذلك يجب أن يكونوا ما؟,It doesn't necessarily have to be four inches. It was at half one. But what did you know about each station? This was four inches and these were four inches. So they must be what?
Eight inches.,student,2,0,,,,ثمانية بوصات,Eight inches
No.,teacher,1,0,,,0.0,-كلا .,"- No , not at all ."
It needs to be three.,student,5,0,,,,يجب أن يكون ثلاثة.,There must be three.
"It needs to be equal.  Each stop needs to be the equal amount. Now, this measurement is going to be the same for any other one.  Okay? But what you need to know is that each stop on this track is going to be equal.  Okay? So is there already a stop on this track?",teacher,55,1,1.0,,0.0,يجب أن تكون متساوية. كل توقف يجب أن يكون بنفس الكمية. الآن، هذه القياسات سوف تكون نفسها لأي واحد آخر. حسنا؟ ولكن ما تحتاج إلى معرفته هو أن كل توقف على هذا المسار سوف تكون متساوية. حسنا؟ لذلك هل هناك بالفعل توقف على هذا المسار؟,"Now, these measurements will be the same for any other. Okay? but what you need to know is that every stop on this path will be equal. Okay? So is there really a stop on this path?"
Yes.,student,1,0,,,,-أجل، أجل,"- Yes, yes, yes"
"Okay, so maybe let’s try and measure that stop to see if that helps us out.  You can use inches if that’s what you feel more comfortable with. So you line it up.",teacher,33,2,,,0.0,حسناً، دعونا نحاول قياس تلك الموقفة لنرى ما إذا كان هذا يساعدنا. يمكنك استخدام بوصات إذا كان هذا ما تشعرين بأنك أكثر راحة به. لذا قم بتصويرها.,"Well, let's try measuring that position to see if that helps us.You can use inches if that's what you're most comfortable with.So take a picture of it."
It would be close to three.,student,6,0,,,,سيكون الأمر قريبًا من الثالثة,It will be close to three o'clock.
"Here.  So now, where can you measure out the first stop? Good, so now where are you going to put the first stop?",teacher,23,1,0.0,,0.0,حسناً، إذاً الآن، أين يمكنك قياس المحطة الأولى؟ الآن، أين ستضع المحطة الأولى؟,"Okay, so now, where can you measure the first station?"
Right here.,student,2,0,,,,هنا تماماً.,Right here.
Good.  And you’re going to label it what?,teacher,8,0,,,0.0,جيد، وماذا ستسميه؟,"Good, and what are you going to call it?"
One-third.,student,1,0,,,,ثلث,One-third
"Good.  So use your ruler, because remember we need to be accurate so that tomorrow when we go to play the game… Now, let’s measure to double-check to see if this is the same amount, and then we know all of our stops are correct.",teacher,45,2,,,0.0,جيد، لذا استخدم الحاكم الخاص بك، لأن تذكر أننا بحاجة إلى أن تكون دقيقة حتى غدا عندما نذهب للعب اللعبة... الآن، دعونا قياس للتحقق مزدوج لمعرفة ما إذا كان هذا هو نفس المبلغ، ثم نعلم جميع توقفنا صحيحة.,"Good, so use your governor, because remember we need to be precise until tomorrow when we go to play the game... Now, let's double-check measurements to see if this is the same amount, and then we all know our stops are correct."
No.,student,1,0,,,,-كلا .,"- No , not at all ."
Is it close enough?,teacher,4,0,,,0.0,هل هو قريب بما فيه الكفاية؟,Is it close enough?
Close.,student,1,0,,,,قريباً,Soon
"Okay, now let’s do that vertical trick that I taught you.  What is one-third also equal to?",teacher,17,1,,,0.0,حسناً، دعونا نفعل هذه الخدعة العمودية التي علمتك بها، ما هو الثلث أيضاً؟,"Well, let's do this vertical trick that I taught you, what else is a third?"
One third is equal to two-sixths.,student,6,0,,,,ثلث يساوي ستين,One-third is equal to sixty
"Good.  So is there already a two-sixths on this game board? So could we have just taken our ruler, lined it up vertically to two-sixths, right? Okay.  So those are the two strategies that you can use.  Use your measurement, or use what you know about the other equivalent fractions that are already on the game board to help you out.  Did you need help?",teacher,65,5,1.0,,0.0,حسناً. إذاً هل هناك بالفعل اثنين من السادس على هذه اللوحة اللعبية؟ لذلك هل يمكن أن نأخذ حاكمنا، ونصفها عمودياً إلى اثنين من السادس، أليس كذلك؟ حسناً. هذه هي الاستراتيجيات التي يمكنك استخدامها. استخدم قياسك، أو استخدم ما تعرفه عن الكسور المتكافئة الأخرى الموجودة بالفعل على اللوحة اللعبية لمساعدتك. هل تحتاج إلى مساعدة؟,"So, can we take our ruler, half perpendicular to two sixths, right? Well, these are the strategies you can use. Use your measurement, or use what you know about other equivalent fractions already on the board to help you."
Somebody erased it.,student,3,0,,,,شخص ما قام بحذفها,Someone deleted it.
"Well those are all just on the left-hand side, the zeroes, those are just the starting points.  This is good, you got this track done.  But two-fourths wouldn’t go here because two-fourths is equivalent to what fraction?",teacher,37,2,,,0.0,حسنا هذه كلها على الجانب الأيسر فقط، الصفر، هذه مجرد نقاط البداية. هذا جيد، حصلت على هذا المسار. ولكن ربعين لن تذهب إلى هنا لأن ربعين يساوي أي جزء؟,"Well, these are all on the left side only, zero, these are just starting points. That's good, I got this path. But 40 won't go here because 40 is equal to any part?"
One-half.,student,1,0,,,,ونصف.,One and a half.
Right.  So remember I showed you this on the board.  One-half is already here for you.  So use what you already have and use what you know to make this easier for you.,teacher,33,0,,,0.0,حسناً، تذكر أنني أريتك هذا على اللوحة، النصف هنا لك بالفعل، لذا استخدم ما لديك بالفعل واستخدم ما تعرفه لجعل الأمر أسهل لك.,"Well, remember that I showed you this on the board, half here is already for you, so use what you already have and use what you know to make it easier for you."
[Inaudible],student,1,0,,,,[غير مسموع],[Unheard of]
"I can turn it a little bit for you but that’s it.  Okay, no, this has to stay here.  If you want to swivel your chair so that your back is against the sun, that’s fine.  So then what is this? They’ve already given you the stop, all you need to do is name that stop.  So if this is the fourths track, what are we missing here?",teacher,68,0,,,0.0,حسناً، لا، هذا يجب أن يبقى هنا. إذا كنت ترغب في تحويل كرسيك بحيث تكون ظهرك ضد الشمس، فهذا جيد. إذاً ما هذا؟ لقد أعطوكوا بالفعل المحطة، كل ما عليك القيام به هو إسم تلك المحطة. إذاً إذا كان هذا هو مسار الرابع، فما الذي نقصده هنا؟,"Well, no, that should stay here. if you want to turn your chair so that your back is against the sun, that's fine. so what is that? they've already given you the station, all you have to do is name that station. so if that's track four, what are we talking about here?"
The thirds.,student,2,0,,,,الثلث.,One-third.
Right.  So that’s equivalent to what fraction?,teacher,7,2,,,0.0,صحيح، هذا يعادل أي جزء؟,"Right, that's equal to what part?"
Three-fifths?,student,1,0,,,,ثلاثة الخامسة؟,Three to five?
"So let’s look at the fifths track.  There’s one, two, three would be about here, does that fall on that line?",teacher,21,1,,,0.0,لذا دعونا ننظر إلى المسار الخامس. هناك واحد، اثنان، ثلاثة سيكون حول هنا، هل هذا يقع على هذا الخط؟,"So let's look at the fifth track. There will be one, two, three going around here, is this on this line?"
Four-eighths.,student,1,0,,,,أربعة ثمانية.,Four eight.
"If I had five pies and I tried to divide them in half, could I do it?",teacher,17,1,,,0.0,إذا كان لدي خمسة فطائر وأحاول تقسيمها إلى النصف، هل يمكنني القيام بذلك؟,"If I had five pies and tried to split them in half, could I do it?"
Four-eighths is…,student,2,0,,,,أربع ثمانية هو...,Four eight is...
"Right, but listen to me, if I had five pies and I wanted to divide them equally among two friends, could I do it?",teacher,24,1,,,0.0,صحيح، لكن اسمعني، إذا كان لدي خمسة فطائر وأردت تقسيمها بالتساوي بين اثنين من الأصدقاء، هل يمكنني القيام بذلك؟,"That's right, but listen to me, if I had five pies and I wanted to split them evenly between two friends, could I do that?"
No.,student,1,0,,,,-كلا .,"- No , not at all ."
"No.  So, four-eighths is one of them, we’ve already done this. You should already have this on your track board, your game board.  What is another fraction? Where’s your pencil? Come on, Student K, we need to stay focused here.  That’s fine. I’ll get you an eraser, but let’s stay focused.  So put your four-eighths on the game board.  That was nice of you, thank you.  Use your ruler to line it up is what I’m saying, Student K.  Keep yourself organized.  Good.  Write four-eighths. What else is equal to one-half on here?",teacher,93,3,,,0.0,لا. لذلك، أربع ثمانية واحدة منهم، لقد فعلنا هذا بالفعل. يجب أن يكون لديك هذا بالفعل على لوحة المسار الخاص بك، لوحة اللعبة الخاصة بك. ما هي الجزء الآخر؟ أين القلم الخاص بك؟ هيّا، الطالب ك، نحن بحاجة إلى البقاء على التركيز هنا. هذا جيد. سأحصل لك على مسح، ولكن دعونا نبقى على التركيز. لذلك ضع أربع ثمانية الخاص بك على لوحة اللعبة. كان ذلك لطيف منك، شكرا لك. استخدام حاكم الخاص بك لترتيبها هو ما أقوله، الطالب ك. حافظ على نفسك منظمة. جيد. كتابة أربع ثمانية. ما هو يساوي نصف هنا؟,"Hey, student K, we need to stay focused here. that's good. i'll get you a scan, but let's stay focused. so put your four eights on the game board. that was kind of nice of you, thank you. using your governor to sort it out is what's wrong."
Five-tenths is already there.,student,4,1,,,,الخمسة العشرات موجودة بالفعل,The fifteen already exists.
Right.  Four-eighths is already there.,teacher,5,0,,,0.0,صحيح، أربعة ثمانية هناك بالفعل.,"That's right, four-eighths are already there."
Three-sixths is down here.,student,4,0,,,,ثلاثة من السادس هنا,Three out of six here
"You have it on the board, but is it placed right?",teacher,11,0,,,0.0,لديك على اللوحة، ولكن هل وضعتها بشكل صحيح؟,"You have it on the board, but have you put it right?"
Nope.,student,1,0,,,,لا، لا، لا.,"No, no, no, no, no, no, no, no, no, no, no, no, no, no, no, no, no, no, no, no, no, no, no, no, no, no, no, no, no, no, no, no, no, no, no, no, no, no, no, no, no, no, no, no, no, no, no, no, no, no, no, no, no, no, no, no, no, no, no, no, no, no, no, no"
"Nope, if it’s equivalent to one-half it’s going to fall where?",teacher,11,1,,,0.0,لا، إذا كان يعادل نصف سيسقط إلى أين؟,"No, if it is equal to half, where will it fall?"
Right here.,student,2,0,,,,هنا تماماً.,Right here.
"Good.  Okay, so now you have your halves.  Student B, I’ll be right with you, but I want you to keep working. Okay, good.  So now, look, you’re almost done with this track.  You just need to add what?",teacher,39,1,,,0.0,حسناً، حسناً، الآن لديكم نصفكم، الطالب ب، سأكون معك في الحال، لكن أريدكم أن تستمروا بالعمل، حسناً، حسناً، الآن، انظروا، انتهيتم تقريباً من هذه المسرحية، تحتاجون إلى إضافة ماذا؟,"Well, well, now you have your half, student B, I'll be with you right away, but I want you to keep working, well, well, now, look, you're almost done with this play, you need to add what?"
Three-fourths.,student,1,0,,,,ثلاثة أرباع.,Three quarters.
"Thank you.  All right.  Stay focused.  Student J, did you need me? Nope, you’re all set?",teacher,16,0,,,0.0,شكراً، حسناً، إبقى مركزاً، الطالب (جاي) ، هل احتجتني؟,"Thank you, well, stay focused, student (Jay), did you need me?"
I just noticed that it makes a few [inaudible].,student,9,0,,1.0,,لقد لاحظت للتو أنه يجعل بعضها [غير قابل للسمع].,I just noticed that it makes some of them [inaudible].
"Cool.  All right.  All right, I’m coming.",teacher,7,0,0.0,,0.0,رائع، حسناً، أنا قادم,"Great, well, I'm on my way."
"I know we can’t measure it one-fourth because that’s half, and since it was three, I thought weren’t we supposed to measure it in [inaudible] to three?",student,27,2,,1.0,,أعلم أننا لا نستطيع قياسها ربعًا لأن هذا نصف، وبما أنه كان ثلاثة، فكرت ألا يفترض أن نقيسها في ثلاثة؟,"I know we can't measure it in a quarter because that's half, and since it was three, I thought we shouldn't measure it in three?"
