text,speaker,talktime_words,math_density,uptake,student_reasoning,focusing_questions,text_arabic,text_back_translated
"Good morning, everybody.  Today, we’re beginning our symmetry, and I’m gonna turn this on and ask for volunteers to come up here and explain to me what the lines of symmetry are and why. So, Juan is using the shapes below to learn about symmetry. A says, “Write the letter of the shape that has more than one line of symmetry.”  Could somebody explain to me what a line of symmetry is? Student D?",teacher,74,8,,,1.0,صباح الخير، الجميع. اليوم، نحن نبدأ التزاوج، وسأقوم بتشغيل هذا وسأطلب من المتطوعين أن يأتوا إلى هنا ويوضحوا لي ما هي خطوط التزاوج ولماذا. لذلك، يستخدم خوان الأشكال أدناه للتعلم عن التزاوج. A يقول، كتب حرف الشكل الذي لديه أكثر من خط واحد من التزاوج.,"Good morning, everyone. Today, we're starting mating, and I'm going to run this and ask volunteers to come here and explain to me what mating lines are and why. So, Juan uses the shapes below to learn about mating."
A line of symmetry is like a way that you can pull the shape.,student,14,2,,0.0,,خط التناظر هو مثل طريقة يمكنك سحب الشكل.,A line of symmetry is like a way to draw a shape.
"Good.  So, if you fold the shape, it should look exactly the same on both sides.  Okay.  Can you give me an example of something that’s symmetrical, Student M?",teacher,29,1,1.0,,1.0,حسناً، إذا قمت بتثبيت الشكل، يجب أن يبدو بنفس الشكل على الجانبين. حسناً، هل يمكنك أن تعطيني مثال على شيء متماثل، الطالب M؟,"Well, if you fix the shape, it should look the same on both sides.Well, can you give me an example of something similar, student M?"
A square.,student,2,1,,,,مربع.,square.
"A square would be symmetrical, because if you folded a square it would look exactly the same on both sides.",teacher,20,3,,,0.0,مربع سيكون متماثلًا، لأنه إذا قمت بتثبيت مربع، فإنه سيكون متشابهًا تماماً على الجانبين.,"The square will be symmetrical, because if you install a square, it will be exactly the same on both sides."
"Oh, a diamond, ’cause when you fold it.",student,8,0,,1.0,,أوه، الماس، لأنه عندما تضعها.,"Oh, diamonds, because when you put them on."
"Okay.  Good, a diamond.  So, where would a line of symmetry be, Student A?",teacher,14,2,1.0,,1.0,حسناً، الماس، إذاً، أين خط التناظر، الطالب (أ) ؟,"Well, diamonds, then, where is the line of symmetry, student (a)?"
Like if you cut it in half.,student,7,0,,,,كما لو أنك قطعتها إلى النصف.,As if you had cut it in half.
"Right.  So, where you fold it or where you cut it in half would be a line of symmetry.  Could things have more than one line of symmetry?",teacher,28,4,1.0,,1.0,حسناً، إذاً، حيث تثبتها أو حيث تقطعها إلى النصف سيكون خط التناظر. هل يمكن للأشياء أن يكون لها أكثر من خط واحد من التناظر؟,"Well, then, where you fix it or where you cut it in half will be the line of symmetry.Can objects have more than one line of symmetry?"
Yes.,student,1,0,,,,-أجل، أجل,"- Yes, yes, yes"
"How – so, can things have more than two lines of symmetry?",teacher,12,2,,,1.0,كيف يمكن للأشياء أن يكون لها أكثر من خطين من التناظر؟,How can things have more than two lines of symmetry?
Yes.,student,1,0,,,,-أجل، أجل,"- Yes, yes, yes"
"Okay.  So, today, we’re gonna see what we have.  So, Juan is using the shapes below to learn about symmetry.  Write the letter of the shape that has more than one line of symmetry.  Who can come up here and help me?  Student A? Careful of the cord, hon.",teacher,49,3,,,0.0,حسناً، اليوم، سنرى ما لدينا، لذا، يستخدم خوان الأشكال أدناه للتعلم عن التماثل، اكتب حروف الشكل التي لديها أكثر من خط واحد من التماثل، من يمكنه أن يأتي إلى هنا ويساعدني؟ الطالب أ؟,"Well, today, we'll see what we have, so Juan uses the shapes below to learn about symmetry, write the letters of the form that have more than one line of symmetry, who can come here and help me?"
[Inaudible],student,1,0,,,,[غير مسموع],[Unheard of]
"Write the letter.  No, it says write the letter of the shape that has more than one line of symmetry. So, he says B.  Can you tell us why?  Could you show us where the lines of symmetry are in B?  Does everyone agree with that?",teacher,46,4,,,1.0,كتابة الحرف. لا، فإنه يقول كتابة الحرف من الشكل الذي لديه أكثر من خط واحد من التناظر. لذلك، وقال انه B. هل يمكنك أن تخبرنا لماذا؟ هل يمكنك أن ترينا أين خطوط التناظر في B؟ هل الجميع يوافقون على ذلك؟,"So, he said it was B. Can you tell us why? Can you show us where the lines of symmetry are in B? Does everyone agree?"
Yes.,multiple students,1,0,,,,-أجل، أجل,"- Yes, yes, yes"
"Does anybody think that there is another shape that has more than one line of symmetry?  Student S, what do you think has more than one line?",teacher,27,3,,,1.0,هل يعتقد أي شخص أن هناك شكل آخر لديه أكثر من خط واحد من التناظر؟ الطالب S، ما الذي تعتقد أن لديه أكثر من خط واحد؟,"Student S, what do you think has more than one line?"
"Oh, more than one line?",student,5,1,,,,أكثر من سطر واحد؟,More than one line?
"It says more than one line.  So, we want to underline.  What would we underline and write the letter of the shape that has more than one line of symmetry?  So, let’s underline that.",teacher,34,6,1.0,,0.0,فهو يقول أكثر من خط واحد. لذا، نريد أن نبرز. ماذا سنبرز ونكتب حرف الشكل الذي لديه أكثر من خط واحد من التناظر؟ لذلك، دعونا نبرز ذلك.,"So, we want to highlight what will we highlight and write a shape letter that has more than one line of symmetry?"
[Inaudible],student,1,0,,,,[غير مسموع],[Unheard of]
"Okay.  So, it says, “B draw all the lines of symmetry into the shape you named.”  Are there any more lines of symmetry in this?",teacher,25,4,,,1.0,حسناً، إذاً، يقول، B رسم جميع خطوط التناظر في الشكل الذي قمت بتسميته. هل هناك أي خطوط التناظر في هذا؟,"Well, then, he says, B drew all the lines of symmetry in the form you named."
No.,student,1,0,,,,-كلا .,"- No , not at all ."
"No, good.  Okay.  So, I’m sorry, Student S, you said that there was one.  Was there another one that you found?",teacher,21,0,,,0.0,لا، جيد، حسناً، أنا آسفة، الطالب (س) ، قلت أن هناك واحدة، هل وجدت واحدة أخرى؟,"No, good, well, I'm sorry, student (s), I said there was one, did you find another?"
"Yeah, it’s C.",student,3,0,,,,أجل، إنه (سي),"Yes, it is (C) "
"So, can you come up here and show us how C would be a line of symmetry.  Thank you, Student A.  How many people agree with Student S?  Okay.  So, you show me where you think it is Student S. Does that look exactly – let’s take a look.  Does this piece look exactly like this piece if we fold it?",teacher,61,2,,,1.0,إذاً، هل يمكنك أن تأتي إلى هنا وتظهر لنا كيف أن C سيكون خط التماثل. شكراً، الطالب A. كم من الناس يوافقون على الطالب S؟ حسناً. إذاً، أرني أين تعتقد أنه الطالب S. هل هذا يبدو بالضبط؟ دعونا نلقي نظرة. هل تبدو هذه القطعة تماماً مثل هذه القطعة إذا قمنا بتثبيتها؟,"So, can you come here and show us how C would be the line of symmetry? Thank you, student A. How many people agree with student S? Okay. So, show me where you think student S. Does that look exactly? Let's take a look. Does this piece look exactly like this piece if we fix it?"
Yes. No.,student,2,0,,,,أجل، كلاّ,"Yes, no, not at all."
How many people think it looks exactly like it?,teacher,9,0,,,1.0,كم من الناس يعتقدون أنها تبدو تماما مثل ذلك؟,How many people think she looks exactly like that?
[Inaudible],student,1,0,,,,[غير مسموع],[Unheard of]
"No, I think this piece is gonna be much bigger than this piece when you fold it over.  Okay?  It’s gonna actually go more like this.  Okay.  So, that would not be line of symmetry. Okay.  So, we have B.  How many people got B? Good.  All right. So, draw all – so, now, on the second one.  It says, “The picture below shows one half of a symmetric shape.  The dotted line represents its line of symmetry.  Draw the other half of the shape.”  Student G, you think you can do that?  Would you like to come up and try?",teacher,101,6,,,1.0,لا، أعتقد أن هذه القطعة ستكون أكبر بكثير من هذه القطعة عندما تطويلها. حسناً؟ ستذهب في الواقع أكثر من هذا. حسناً. إذاً، هذا لن يكون خط التناظر. حسناً. إذاً لدينا B. كم عدد الأشخاص الذين حصلوا على B؟ جيد. حسناً. إذاً، رسم كل  الآن، على الثاني. يقول:  الصورة أدناه تظهر نصف الشكل التناظر. الخط المقطوع يمثل خط التناظر. رسم النصف الآخر من الشكل.  الطالب G، هل تعتقد أنه يمكنك القيام بذلك؟ هل تود أن تأتي وتحاول؟,"No, I think this piece is going to be much bigger than this piece when you fold it. Okay? You're actually going to go more than that. Okay. So this won't be the line of symmetry. Okay. So we have B. How many people got B? Good. Okay. So, draw all now, on the second. Say: The picture below shows the half-shaped symmetry. The half-shaped line represents the line of symmetry. Draw the other half of the shape. Student G, do you think you can do that?"
Okay.,student,1,0,,,,-حسناً,-Well then
"Student C, yeah, just get your things and you can go over to [inaudible]. How many people agree with that?  Student G, [inaudible] ’cause, now, I’m gonna have you do one more thing. How many people agree with that?  Okay.  Is there anybody that disagrees with that?",teacher,47,0,,,1.0,الطالب (ج) ، نعم، فقط أحضر أشيائك ويمكنك الذهاب إلى (لا يسمع) كم من الناس يوافقون على ذلك؟ الطالب (ج) ، [لا يسمع] لأن الآن، سأجعلك تفعل شيئاً واحداً آخر. كم من الناس يوافقون على ذلك؟ حسناً، هل هناك أي شخص يختلف مع ذلك؟,"Student (c), yes, just get your stuff and you can go to (didn't hear) how many people agree? Student (c), [didn't hear] because right now, I'm going to make you do one more thing."
Wait.,student,1,0,,,,انتظروا,Wait a minute
"Okay.  Can you do me a favor, since you’re up here, can you show me where the lines – if there’s another line of symmetry?  Is there another line of symmetry, do you think? Or is it just that one line of symmetry?  Awesome, that’s great.  Okay.  Everybody agree?",teacher,49,7,,,1.0,حسناً. هل يمكنك أن تفعل لي معروفاً، بما أنك هنا، هل يمكنك أن تريني أين خطوط  إذا كان هناك خط آخر من التناظر؟ هل هناك خط آخر من التناظر، هل تعتقد؟ أم أنها مجرد خط واحد من التناظر؟ رائع، هذا عظيم. حسناً. الجميع متفق؟,"Well, can you do me a favor, since you're here, can you show me where the lines are if there's another line of symmetry? Is there another line of symmetry, do you think? or is it just one line of symmetry?"
Yes.,multiple students,1,0,,,,-أجل، أجل,"- Yes, yes, yes"
"Okay.  All right.  Number 3, “Which figure below has only one line of symmetry?  Show how you know.”  So, what am I gonna underline on that?",teacher,26,3,,,0.0,حسناً، حسناً، رقم 3، أي رقم أدناه لديه خط واحد فقط من التناظر؟,"Well, well, number 3, which number below has only one line of symmetry?"
Which –,student,2,0,,,,أي ,There's no such thing as 
Which figure below has only one line of symmetry?,teacher,9,2,,,0.0,أي رقم أدناه لديه خط واحد فقط من التماثل؟,Which number below has only one line of symmetry?
One line of symmetry.,student,4,2,,,,خط واحد من التماثل.,One line of symmetry.
"Excellent.  One line of symmetry and show how you know.  So, how would you show it?  By doing what?",teacher,19,2,,,1.0,ممتاز، خط واحد من التزاوج وتظهر كيف تعرف، لذا، كيف ستظهر ذلك؟,"Excellent, one line of mating and showing how you know, so, how will you show that?"
[Inaudible] of symmetry.,student,3,1,,,,[غير مسموع] من التماثل.,[Unheard] of resemblance.
By what?,teacher,2,0,,,0.0,من خلال ماذا؟,Through what?
[Inaudible],student,1,0,,,,[غير مسموع],[Unheard of]
"Yeah, you said by doing –",teacher,6,0,,,0.0,أجل، قلت بذلك,"Yeah, that's what I said."
[Inaudible],student,1,0,,,,[غير مسموع],[Unheard of]
"– the line in symmetry.  Good.  So, come on up here and show me which one has only one line of symmetry.  Remember what you underlined and go back and read that question afterwards and make sure that you did it right.  Which one has only one line of symmetry?",teacher,50,7,,,0.0, الخط في التناظر. جيد. لذا، تعال هنا وأرني أي واحد له خط واحد فقط من التناظر. تذكر ما تم التأكيد عليه والعودة وقراءة هذا السؤال بعد ذلك والتأكد من أنك فعلتها بشكل صحيح. أي واحد له خط واحد فقط من التناظر؟,"So, come here and show me which one has only one line of symmetry. Remember what was emphasized, come back and read this question afterwards and make sure you did it correctly. Which one has only one line of symmetry?"
"Do you like the – I mean, the ladder on the bottom or –",student,14,0,,0.0,,هل تحبين الدرج في الأسفل أو الدرج,Do you like the stairs at the bottom or the stairs?
"You can circle the one that you think is right, and then I’m gonna ask you to find the lines for me.  So, you want one with only one line of symmetry.  Okay.  So, show me the one line of symmetry.  How many people agree with that? Okay.  Did anybody see another line of symmetry in that shape?",teacher,58,8,0.0,,1.0,يمكنك أن تدور حول تلك التي تعتقد أنها صحيحة، ثم سأطلب منك أن تجد لي الخطوط. لذلك، تريد واحدة مع خط واحد فقط من التناظر. حسنا. لذلك، أرني خط واحد من التناظر. كم من الناس توافق على ذلك؟ حسنا. هل رأى أي شخص خط آخر من التناظر في هذا الشكل؟,"So, you want one with only one line of symmetry. Okay. So, show me one line of symmetry. How many people agree with that? Okay. Has anyone seen another line of symmetry in this form?"
"Oh, yeah.",student,2,0,,,,أوه، نعم.,"Oh, yeah."
"You did, okay.  Student C, can you come up and show me the other line of symmetry there then?",teacher,19,2,,,1.0,الطالب (سي) ، أيمكنك أن تأتي وتريني الخط الآخر من التناظر هناك؟,"Student (C), can you come and show me the other line of symmetry there?"
Of the other?,student,3,0,,,,من الآخر؟,Who else?
"Is there another one?  Or are the others?  Whatever you want to do.  Oh, no, no.  I’m asking you about the other line of symmetry.  You said there’s another line of symmetry in that shape.",teacher,35,4,,,0.0,هل هناك خط آخر؟ أو هم الآخرون؟ أياً كان ما تريد فعله. أوه، لا، لا. أنا أسألك عن الخط الآخر من التناظر. قلت أن هناك خط آخر من التناظر في هذا الشكل.,"Is there another line? or the others? whatever you want to do. oh, no, no. i'm asking you about the other line of analogy. you said that there is another line of analogy in this form."
Which ones?,student,2,0,,,,-أيهما؟,- Which one?
"Okay.  It’s a little bit off.  It would go in the middle.  What kind of a triangle is this, everyone?",teacher,20,1,,,0.0,حسناً، إنه خارج قليلاً، سيكون في الوسط، ما نوع مثلث هذا، الجميع؟,"Well, it's a little outside, it'll be in the middle, what kind of triangle is this, everybody?"
"Oh, oh –",student,3,0,,,,أوه، أوه ,"Oh, oh, oh "
"It’s called in [Elvis] and it’s all the sides are equal, so it’s called an –",teacher,16,0,,,0.0,يُدعى (إلفيس) وكل الجوانب متساوية، لذا يُدعى (إلفيس),"It's called (Elvis) and all sides are equal, so it's called (Elvis) "
Equal –,student,2,0,,,,متساوية ,Equal to each other 
Equilateral triangle.,teacher,2,2,,,0.0,مثلث متساوي,An equilateral triangle
It’s called an equilateral.,student,4,1,,,,يُسمى مساوية.,It's called equality.
"Equilateral triangle.  So, on a equilateral triangle, look, we’ve got a line that comes this way, you got a line that comes this way and you got a line that comes this way.  So, I wasn’t sure that that is the only one with one line of symmetry.  No, that would not be our answer. Student N, you think you know?  Can you come up here?",teacher,66,9,,,0.0,"مثلث متساوي. اذا, على مثلث متساوي, انظر, لدينا خط يأتي من هذا الطريق, لديك خط يأتي من هذا الطريق و لديك خط يأتي من هذا الطريق. لذلك, لم أكن متأكدا من أن هذا هو الوحيد مع خط واحد من التناظر. لا, هذا لن يكون إجابتنا. الطالب N, هل تعتقد أنك تعرف؟ هل يمكنك الصعود هنا؟","So, on an equilateral triangle, look, we have a line coming this way, you have a line coming this way and you have a line coming this way. So, I wasn't sure if this was the only one with a single line of symmetry. No, that wouldn't be our answer."
"Oh, I know.",student,3,0,,,,أوه، أنا أعرف.,"Oh, I know."
Is Student N – is it okay – did Student N sign the sheet? Double check that.  Make sure he can be in the –,teacher,25,0,,,0.0,هل الطالب N  هل هو على ما يرام  هل الطالب N توقيع ورقة؟ تحقق من ذلك مرتين. تأكد من أنه يمكن أن يكون في ,Is student N OK is student N signing a paper? check it twice. make sure it can be in 
Huh?,student,1,0,,,,هاه؟,That's right.
"Did you sign this sheet so you can be videoed?  We’ll find out. Okay.  So, if we fold this over this way, it will look the same, right?  Can we fold it any other way?",teacher,35,0,,,0.0,هل وقعت على هذه الورقة لكي يتم تصويرك؟ سنكتشف ذلك. حسناً، إذا قمنا بتثبيتها بهذه الطريقة، ستبدو نفسها، صحيح؟ هل يمكننا أن نقوم بتثبيتها بطريقة أخرى؟,"Well, if we fix it this way, it will look the same, right? Can we fix it another way?"
No.,multiple students,1,0,,,,-كلا .,"- No , not at all ."
"No, we can’t so that’s why we – how many lines of symmetry in G?  Can you show us, Student L?  You think there’s more than one in G?",teacher,29,2,,,1.0,لا، نحن لا نستطيع لذلك لماذا نحن لدينا عدد خطوط التناظر في G؟ هل يمكنك أن تظهر لنا، الطالب L؟ هل تعتقد أن هناك أكثر من واحد في G؟,"No, we can't, so why do we have the number of parallel lines in G? Can you show us, student L? Do you think there is more than one in G?"
There’s more [inaudible] it.,student,4,0,,,,هناك أكثر من ذلك.,There's more to it than that.
"Okay.  So, I’m sorry, Student N, you’re in the video.  So, you need to be sitting in the back, hon.  Next time, maybe, more people will bring it. Are there any more than that?  So, if it’s a circle –",teacher,40,1,,,0.0,حسنا، أنا آسف، الطالب ن، أنت في الفيديو، لذا، أنت بحاجة إلى الجلوس في الخلف، عزيزي. في المرة القادمة، ربما، المزيد من الناس سيأتي به. هل هناك أي أكثر من ذلك؟,"Well, I'm sorry, student N, you're in the video, so you need to sit in the back, honey."
There’s a lot of lines.,student,5,1,,,,هناك الكثير من الخطوط,There are a lot of lines.
"Yeah, there’s a lot of lines.  Look at this.  So, you can keep going, right?  So, there’s many lines of symmetry in a circle.  What about this one?  Is this one symmetrical?",teacher,32,5,1.0,,1.0,نعم، هناك الكثير من الخطوط. انظر لهذا. لذلك، يمكنك الاستمرار، أليس كذلك؟ لذلك، هناك العديد من الخطوط من التناظر في الدائرة. ماذا عن هذا؟ هل هذا واحد متناظر؟,"So, you can go on, right? So, there are many parallel lines in the circle. What about this? Is this one parallel?"
"Yes, yes.",student,2,0,,,,-أجل، أجل,"- Yes, yes, yes"
Is F symmetrical?,teacher,3,1,,,0.0,هل F متماثل؟,Is F symmetrical?
Yes.,multiple students,1,0,,,,-أجل، أجل,"- Yes, yes, yes"
"Student K, what do you think?",teacher,6,0,,,1.0,الطالب كيه، ما رأيك؟,"Student Kay, what do you think?"
Yes.,student,1,0,,,,-أجل، أجل,"- Yes, yes, yes"
"So, you’re saying if you fold F, it’ll look exactly the same on the other side?",teacher,16,0,,,1.0,إذاً، هل تقصد أنه إذا قمت بتثبيت F، فسوف يبدو نفس الشيء تماماً على الجانب الآخر؟,"So, do you mean that if you install F, it will look exactly the same on the other side?"
No.,student,1,0,,,,-كلا .,"- No , not at all ."
Who can show me where it was gonna be exactly the same? Student M?,teacher,14,0,,,1.0,من يمكنه أن يظهر لي أين سيكون نفس الشيء بالضبط؟,Who can show me where exactly the same thing will be?
Um.,student,1,0,,,,امم.,Umm. 
"Okay.  So, then, if I – hold on just a second, honey.  If I fold this, this way, isn’t this gonna look like this? Isn’t this gonna come down?  Yeah, I’m gonna fold this here.",teacher,35,0,,,0.0,حسناً إذاً، إذاً إذاً، إذاً، إذاً، إذاً، إذاً، إذاً، إذاً، إذاً، إذاً، إذاً، إذاً، إذاً، إذاً، إذاً، إذاً، إذاً، إذاً، إذاً، إذاً، إذاً، إذاً، إذاً، إذاً، إذاً، إذاً، إذاً، إذاً، إذاً، إذاً، إذاً، إذاً، إذاً، إذاً، إذاً، إذاً، إذاً، إذاً، إذاً، إذاً، إذاً، إذاً، إذاً، إذاً، إذاً، إذاً، إذاً، إذاً، إذاً، إذاً، إذاً، إذاً، إذاً، إذاً، إذاً، إذاً، إذاً، إذاً، إذاً، إذاً، إذاً، إذاً، إذاً، إذاً، إذاً، إذاً، إذاً، إذاً، إذاً، إذاً، إذاً، إذاً، إذاً، إذاً، إذاً، إذاً، إذاً، إذاً، إذاً، إذاً، إذاً، إذاً، إذاً، إذاً، إذاً، إذاً، إذاً، إذاً، إذاً، إذاً، إذاً، إذاً، إذاً، إذاً، إذاً، إذاً، إذاً، إذاً، إذاً، إذاً، إذاً، إذاً، إذاً، إذاً، إذاً، إذاً، إذاً، إذاً، إذاً، إذاً، إذاً، إذاً، إذاً، إذاً، إذاً، إذاً، إذاً، إذاً، إذاً، إذاً، إذاً، إذاً، إذاً، إذاً، إذاً، إذاً، إذاً، إذاً، إذاً، إذاً، إذاً، إذاً، إذاً، إذاً، إذاً، إذاً...,"Well, well, well, well, well, well, well, well, well, well, well, well, well, well, well, well, well, well, well, well, well, well, well, well, well, well, well, well, well, well, well, well, well, well, well, well, well, well, well, well, well, well, well, well, well, well, well, well, well, well, well, well, well, well, well, well, well, well, well, well, well, well, well, well"
Oh.,student,1,0,,,,-أوه .,-Oh .
