text,speaker,talktime_words,math_density,uptake,student_reasoning,focusing_questions,text_arabic,text_back_translated
"Well, you have to kind of follow what it says.  You’re gonna have to draw the design.  So, you have to draw one pattern that you come up with for Number 2. And then, for Number 3, you can – kind of like we talked about before, conjectures are kind of like guesses in math, right?  You can come up with conjectures and say, oh, well, I think 10 times 1 times 3 is gonna work or something like that. But how do you know?  You have to find some way to figure out if that’s gonna work.  You have to build it or draw it or be able to explain it to us.  ’Cause what we’re gonna do is I have a chart that we’re gonna put up at the end and we’re gonna come up with all different ways that we can build that new box. Got it?",teacher,150,0,0.0,,0.0,حسناً، عليك أن تتبع ما يقوله نوعاً ما. عليك أن ترسم التصميم. لذا، عليك أن ترسم نمطاً واحداً يمكنك أن تأتي به للرقم الثاني. ومن ثم، بالنسبة للرقم الثالث، يمكنك أن ترسم نوعاً ما مثل ما تحدثنا عنه سابقاً، الافتراضات نوعاً ما مثل الافتراضات في الرياضيات، صحيح؟ يمكنك أن تأتي بآفتراض وتقول، أوه، حسناً، أعتقد أن 10 × 1 × 3 سوف تنجح أو شيء من هذا القبيل. ولكن كيف تعرف؟ عليك أن تجد طريقة لتحديد ما إذا كانت ستنجح؟ عليك أن تبنيها أو ترسمها أو تكون قادرة على شرحها لنا.,"Well, you kind of have to follow what he says. You kind of have to draw the design. So, you have to draw one pattern that you can bring to the second number. And then, for the third number, you can draw something like what we talked about earlier, assumptions kind of like assumptions in mathematics, right? You can come up with assumptions and say, oh, well, I think 10 × 1 × 3 will work or something like that. but how do you know?"
Yeah.,student,1,0,,,,-أجل، أجل,"- Yes, yes, yes"
"Okay.  You’re off. Anybody that wants to build with paper, there’s tons of it. Anybody that wants to build with cubes, we’ll hand them out to you.  Anybody know they want to build with paper? Paper, anybody else? We have some.",teacher,41,1,,,1.0,حسناً، أنت ذاهب. أي شخص يريد بناء من الورق، هناك طن من ذلك. أي شخص يريد بناء من الكوبات، سنقوم بتوزيعها لك. أي شخص يعرف أنهم يريدون بناء من الورق؟ الورق، أي شخص آخر؟ لدينا بعض.,"Well, you're going. Anyone who wants to build from paper, there's a ton of it. Anyone who wants to build from cups, we'll distribute them to you. Anyone who knows they want to build from paper? Paper, anyone else? We have some."
What do you mean by build with paper?,student,8,0,,0.0,,ماذا تعني بإنشاء الورق؟,What do you mean by creating paper?
"Like we did before, build a pattern on the bottom.",teacher,10,0,1.0,,0.0,كما فعلنا من قبل، بناء نمط على القاع.,"As we have done before, building a pattern on the bottom."
Oh.,student,1,0,,,,-أوه .,-Oh .
"But you’re building it for that new one, so you have to figure out the volume of it first. So, my question for this first one, Number 1, what is the volume of the first box the factory gave us?  Come on, guys.  We talked about it.  It’s right here written out for you.  Student A?",teacher,56,2,,,0.0,ولكنك تقوم ببناءها لهذا الجديد، لذا عليك أن تعرف حجمها أولاً. لذا، سؤالي لهذا الأول، رقم واحد، ما هو حجم الصندوق الأول الذي أعطتناه المصنع؟ هيّا يا رفاق. تحدثنا عنه. إنه مكتوب هنا لكم. الطالب A؟,"So, my question to this first one, number one, what was the size of the first box we gave to the factory? Come on guys. We talked about it. It's written here for you. Student A?"
30.,student,1,0,,,,ثلاثون,thirty-three.
How’d you get it?,teacher,4,0,,,1.0,كيف حصلت عليها؟,How did you get it?
I multiplied 2 times 6 – 2 times 3 equals 6.,student,11,1,,0.0,,مضاعفة 2 × 6  2 × 3 = 6.,Double 2 × 6 2 × 3 = 6.
2 times 3 is 6.,teacher,5,0,1.0,,0.0,2 × 3 = 6,3 × 3 = 6 2 2
Times 5 is 30.,student,4,0,,,,وقت الخامس هو 30,The fifth time is 30.
"Units cubed, right?",teacher,3,2,,,0.0,وحدات مكعب، أليس كذلك؟,"Cubic units, right?"
Yep.,student,1,0,,,,-أجل .,- Yes .
"So, now, for the Number 2, what’s the volume that our focus is about?  Student J?",teacher,16,1,,,0.0,إذاً، الآن، بالنسبة للرقم الثاني، ما هو الحجم الذي نركز عليه؟ الطالب J؟,"So, now, for the second number, what size are we focusing on? student J?"
Double it.,student,2,0,,,,مضاعفة.,doubled.
"Double it, which is?",teacher,4,0,,,0.0,مضاعفة، أي هو؟,"Double, which is it?"
60.,student,1,0,,,,الـ60,The 60's.
"60.  So, you’re trying to build boxes that are gonna hold 60 cubes.  And what we’re looking for is how many of these can you come up with?  What are the dimensions, right?  That’s your job. So, you can sit here.  And if you’re using cubes, you’re gonna need 60 of them, right?  And if you’re using paper –",teacher,59,3,,,0.0,إذاً، أنت تحاول بناء صناديق يمكنها أن تحتوي على 60 مكعب. ونحن نبحث عن عدد هذه التي يمكنك أن تأتي بها؟ ما هي الأبعاد، أليس كذلك؟ هذه وظيفتك. لذلك، يمكنك الجلوس هنا. وإذا كنت تستخدم مكعبات، ستحتاج إلى 60 منها، أليس كذلك؟ وإذا كنت تستخدم الورق,"So, you're trying to build boxes that can hold 60 cubic feet. and we're looking for that number that you can come up with? what are the dimensions, right? that's your job. so, you can sit here. and if you're using cubic feet, you'll need 60 of them, right? and if you're using paper"
[Inaudible.],student,1,0,,,,[غير مسموع.],[Unheard of.]
"You’re gonna have to figure it out, you know what I mean?  So, you might want to use both.  There’s a ton going on.  You?",teacher,25,0,,,0.0,عليك أن تفهم الأمر، أتفهمين ما أعنيه، لذا، قد ترغب في استخدام كليهما.,"You have to understand it, you know what I mean, so you might want to use both."
Do we skip 3?,student,4,0,,,,هل نقفز 3؟,Shall we jump three?
"You don’t skip 3.  The thing is for 3, you need to make a design that’s gonna work.",teacher,18,0,,,0.0,الشيء هو لثلاثة، تحتاج إلى جعل تصميم سوف تعمل.,"The thing is for three, you need to make a design that will work."
On grid paper?,student,3,0,,,,على ورقة الشبكة؟,On the web page?
"We can make it on grid paper.  You can make it with cubes, but you have to be able to prove to me it’s gonna work.",teacher,26,1,,,0.0,يمكننا القيام بذلك على ورق الشبكة يمكنك القيام بذلك مع الكوبات، ولكن عليك أن تكون قادرة على إثبات لي أنها ستعمل.,"You can do it with cups, but you have to be able to prove to me that it will work."
"Like, can I have some grid paper?",student,7,0,,,,مثل، هل يمكنني الحصول على بعض ورقة الشبكة؟,"For example, can I get some network paper?"
"Absolutely.  Build me the box if you can.  Pretend like, you know, for social studies, you’re making commercials to get people to come to your colonial area.  Think about the same thing for this.  If you’re working in a factory, how can you prove to the people that run the factory –",teacher,52,1,1.0,,1.0,بالتأكيد. قم ببناء الصندوق بالنسبة لي إن أمكنك. تظاهري، كما تعلمون، للدراسات الاجتماعية، أنت تقوم بإصدار إعلانات لجعل الناس يأتون إلى منطقتك الاستعمارية. فكر في الشيء نفسه لهذا. إذا كنت تعمل في مصنع، كيف يمكنك إثبات للناس الذين يديرون المصنع,"Make a box for me if you can. Pretend, you know, for social studies, you're putting out ads to get people to come to your colonial area."
Which one is the –,student,5,0,,,,أي واحد هو ,Which one is 
– that your box will really hold 60 cubes.,teacher,9,1,0.0,,0.0,أن صندوقك سيحتوي حقاً على 60 مكعب,That your box will actually contain 60 cubic meters.
What’s the bottom?,student,3,0,,,,ما هو الجزء السفلي؟,What's the bottom part?
"What is the bottom?  Well, the thing is, Student J, that it’s the bottom when – you could say the bottom is 2 times 3, right?  ’Cause you could say the bottom is?",teacher,33,0,,,0.0,ما هو الجزء السفلي؟ حسنا، الشيء هو، الطالب J، أنه هو الجزء السفلي عندما يمكنك أن تقول أن الجزء السفلي هو 2 × 3، أليس كذلك؟,"Well, the thing is, student J, that's the bottom when you can say that the bottom is 2 × 3, right?"
2 times 3.,student,3,0,,,,2 × 3,2 × 3 2 × 3
"2 times 3.  And then, the height would be?  So, we know that Student A said the base is gonna be 6, right?  Which would mean?",teacher,26,0,,,0.0,2 × 3 ثم، الارتفاع سيكون؟ إذاً، نحن نعلم أن الطالب A قال أن القاعدة ستكون 6، صحيح؟ وهذا يعني؟,"So, we know that student A said the rule would be 6, right?"
[Inaudible.],student,1,0,,,,[غير مسموع.],[Unheard of.]
"Right?  ’Cause that’s gonna be 6 – 1, 2, 3, 4, 5 times, which holds 30 cubes.  Does that have to be?  That’s what we wanna talk about, ’cause you could also have a base that is –",teacher,38,1,,,0.0,صحيح؟ لأن هذا سيكون 6  1، 2، 3، 4، 5 مرات، والذي يحتوي على 30 مكعب. هل يجب أن يكون ذلك؟ هذا ما نريد التحدث عنه، لأنه يمكن أن يكون لديك أيضا قاعدة هي ,"Because that would be 6 times 1, 2, 3, 4, 5 times, which contains 30 cubes."
15.,student,1,0,,,,15.,15.
"15, which would be?  And then, the sides would be?  And that way, you’d have 2 rows of 15 on top of each other.  They both equal 30 cubes, right?  So, now, your job is how can you work with these numbers to then make patterns that hold 60. Does that mean I want you guys to recreate the wheel here? Let’s focus on the numbers they gave us.  How could we work with those and get 60 cubes?",teacher,79,2,,,1.0,15، أي سيكون؟ ومن ثم، الجانبين سيكون؟ وبهذه الطريقة، سيكون لديك 2 صفين من 15 فوق بعضها البعض. كلاهما يساوي 30 مكعب، أليس كذلك؟ الآن، وظيفتك هي كيف يمكنك العمل مع هذه الأرقام ثم جعل أنماط التي تحتوي على 60؟ هل هذا يعني أنني أريدك أن تعيد إنشاء العجلة هنا؟ دعونا نركز على الأرقام التي أعطونا. كيف يمكننا العمل مع تلك والحصول على 60 مكعب؟,"In this way, you will have 2 rows of 15 on top of each other. Both are equal to 30 cubes, right? Now, your job is to work with these numbers and then make patterns that contain 60? Does this mean that I want you to recreate the wheel here? Let's focus on the numbers they gave us. How can we work with those and get 60 cubes?"
Do you have 1 times [inaudible] 3 times 1?,student,9,0,,0.0,,هل لديك 1 × [غير مسموع] 3 × 1؟,Do you have 1 × [inaudible] 3 × 1?
"If you think that’ll work, sure.  We said that for 12, right? This box here will hold 12 cubes, will it not?",teacher,22,1,0.0,,0.0,إذا كنت تعتقد أن هذا سوف ينجح، بالتأكيد. لقد قلنا ذلك لمدة 12، أليس كذلك؟ هذا الصندوق هنا سوف تحتوي على 12 مكعب، أليس كذلك؟,"We've been saying that for 12 years, haven't we? this box here will contain 12 cubic feet, right?"
Yes.,student,1,0,,,,-أجل، أجل,"- Yes, yes, yes"
"It’ll be a tall, skinny box, but it’ll work.  And the base is gonna be 1 times 1 and the height is?",teacher,22,0,,,0.0,سيكون مربعاً طويلاً و رقيقاً، ولكنه سينجح، والقاعدة ستكون 1 × 1، والارتفاع هو؟,"It will be a long, thin square, but it will succeed, and the base will be 1 × 1, and the height is?"
12.,student,1,0,,,,12,12  12 
"So, Student M –",teacher,4,0,,,0.0,لذا، الطالب M ,"So, the student M "
Yes.,student,1,0,,,,-أجل، أجل,"- Yes, yes, yes"
"– this is a 1 by 1 by 12.  So, would 1 by 1 by 60 work?",teacher,17,0,,,1.0, هذا هو 1 × 1 × 12. إذاً، هل 1 × 1 × 60 يعمل؟,"This is 1 × 1 × 12.So, does 1 × 1 × 60 work?"
Uh-huh.,student,1,0,,,,اه-ها.,Ah-ha. 
"Absolutely, so draw it and prove it. See, how Teacher S’s cutting idea should be perfect to come to the meeting and say, Teacher J, this box will hold 60. I know, because you can actually see it.  I can prove it to you. So, what are you drawing?",teacher,49,0,,,1.0,بالتأكيد، لذا ارسمها و أثبتها. انظر، كيف يجب أن تكون فكرة تقطيع المعلم S مثالية للوصول إلى الاجتماع وقول، المعلم J، هذا الصندوق سيبقى 60، أعرف، لأنك يمكن أن ترى ذلك في الواقع. يمكنني أن أثبت ذلك لك. لذا، ماذا ترسم؟,"Look, how should the idea of cutting master S be ideal to get to the meeting and say, Master J, this box will stay 60, I know, because you can actually see it."
I’m trying to reach this box.,student,6,0,,,,أنا أحاول الوصول إلى هذا الصندوق,I'm trying to get to this box.
"Okay.  So, 5 by 5.",teacher,5,0,0.0,,0.0,حسناً، 5×5,"Well, 5x5"
But he won’t –,student,4,0,,,,لكنه لن يفعل,But he won't.
"So, you know what to do?  You can do it there and you can do it there, right?  There, you only have that and, there, you only have that.  So, if you cut that out.",teacher,35,0,,,0.0,يمكنك القيام بذلك هناك ويمكنك القيام به هناك، صحيح؟ هناك، لديك فقط ذلك، وهنا، لديك فقط ذلك. لذا، إذا كنت تقطع ذلك.,"You can do it there and you can do it there, right? there, you only have that, and here, you only have that."
But that’s 4.  I need 3.,student,6,0,,,,لكن هذا 4 أحتاج 3,"But that's four, I need three."
"I know.  No, no, no.  You have 3 up here, right, and 3 up here. But you only ever have –",teacher,21,0,1.0,,0.0,أعلم، لا، لا، لا، لديك ثلاثة هنا، صحيح، وثلاثة هنا، ولكن لديك فقط ,"I know, no, no, no, you have three here, right, and three here, but you only have "
Oh.,student,1,0,,,,-أوه .,-Oh .
"– 2 up here and 2 up here.  So, if we cut this and just tape it there, you’ll have a third row.  And then, we need to cut that out and tape it with that one.",teacher,37,0,,,0.0, 2 هنا و 2 هنا إذا قطعنا هذا و مجرد تسجيله هناك سيكون لديك صف ثالث ثم نحتاج الى قطع هذا و تسجيله مع هذا,2 here and 2 here if we cut this and just record it there you will have a third row then we need to cut this and record it with this
Yeah.,student,1,0,,,,-أجل، أجل,"- Yes, yes, yes"
"You know what I mean?  Watch, I’ll show you.  Do you have tape?",teacher,13,0,,,0.0,هل لديك شريط؟,Do you have a tape?
Here you go.,student,3,0,,,,ها أنت ذا,There you go.
You have that.,teacher,3,0,,,0.0,لديك هذا,You've got this.
"Ooh, just pasted it.",student,4,0,,,,لقد ملصقتها للتو,I just put a sticker on it.
"You have that [inaudible].  And see, if you tape this here and, now, you’re able to have – sometimes, the patterns are just too big for the paper.  So, you have to cut some extra pieces out.  You are a tape waster, huh?",teacher,43,0,,,0.0,لديك ذلك (غير قابل للسمعة) و انظر، إذا قمت بتسجيل هذا هنا و الآن، أنت قادرة على الحصول على  في بعض الأحيان، أنماط كبيرة جدا للورقة. لذلك، عليك قطع بعض القطع الإضافية. أنت ضائع الشريط، أليس كذلك؟,"You have that (unreputable) and look, if you record this here and now, you're able to get sometimes, very large patterns of paper. so, you have to cut some extra pieces. you're losing the tape, aren't you?"
[Laughs],student,1,0,,,,[ضحك],[laughs]
"All right, now, you have your pattern.  You just had to use an extra piece.",teacher,15,0,,,0.0,حسناً، لديك نمطك، كان عليك فقط استخدام قطعة إضافية,"Well, you have your own style, you should have just used an extra piece."
Can I have [inaudible] –,student,5,0,,,,هل يمكنني الحصول على [غير مسموع] ,Can I have [unheard of] 
Grid paper?  This?,teacher,3,0,0.0,,0.0,ورق الشبكة؟,Network paper?
"No, the one that’s smaller.",student,5,0,,,,لا، الذي هو أصغر.,"No, the smaller one."
"No, you have to use that one.  So, you might need to use more than one piece, like imagine this piece here.  Student J had to cut extra rows off and put them on to make his pattern bigger.",teacher,39,0,1.0,,0.0,لا، يجب أن تستخدم هذه. لذلك، قد تحتاج إلى استخدام أكثر من قطعة واحدة، مثل تخيل هذه القطعة هنا. كان على الطالب J قطع صفوف إضافية وضعه عليها لجعل نمطه أكبر.,"No, you should use these. So, you may need to use more than one piece, like imagine this piece here. Student J had to cut additional rows and put them on them to make his pattern bigger."
Hmm.,student,1,0,,,,-حسناً,-Well then
"So, if your pattern is not fitting on one sheet, cut some squares off another sheet.  That’s why we have a bunch.",teacher,22,1,,,0.0,لذا، إذا كان نمطك لا يناسب على ورقة واحدة، قطع بعض المربع من ورقة أخرى.,"So, if your style doesn't fit one sheet, cut some of the square off from another sheet."
What do you have to do for Number 3?,student,9,0,,0.0,,ما الذي يجب عليك فعله من أجل رقم 3؟,What should you do for number 3?
"Well, that’s when it goes on to the challenge for Number 4. So, technically, for 3, you only need 1.  But for 4, they challenge you to find as many as you can.",teacher,33,0,1.0,,0.0,حسناً، هذا عندما يتحول الأمر إلى تحدي الرقم 4، لذا، تقنياً، للثلاثة، تحتاج إلى واحد فقط، ولكن للـ4، يحدونك للعثور على أكبر عدد ممكن.,"Well, that's when it becomes the number 4 challenge, so, technically, for three, you only need one, but for four, you're limited to finding as many numbers as possible."
Because I got a bunch of ’em.,student,7,0,,,,لأنني حصلت على مجموعة منهم.,Because I got a bunch of them.
The back row is not even using any manipulatives to build –,teacher,12,0,0.0,,0.0,الصف الخلفي لا يستخدم حتى أي التلاعب لبناء,The back row doesn't even use any manipulation to build.
"Well, you have to build? No, no, we don’t have to build.",student,12,0,,0.0,,لا، لا، ليس علينا البناء,"No, no, we don't have to build."
"The thing is, it’s gonna be hard for them to prove to me if it works, right, ’cause they’re gonna be, like – I have to take their word for it.",teacher,31,0,0.0,,0.0,الأمر هو أنه سيكون من الصعب عليهم إثبات لي إذا كان يعمل، صحيح، لأنهم سيكونون، مثل، يجب أن أؤمن بكلمتهم لذلك.,"The thing is, it's going to be hard for them to prove to me if it works, right, because they're going to be, like, I have to take their word for it."
Challenge.,student,1,0,,,,التحدي.,The challenge.
"It’s a lot easier if you have a model to show, right?  If you have a model with cubes or with paper, you can say, Teacher J, this box holds 5 cubes.  I’m proving it to you, because I built it right in front of you, right?  If it’s a drawing, I might say, I don’t know.  I can’t see it, ’cause it’s not three dimensional.  Boxes are three dimensional, right?",teacher,71,4,,,0.0,من الأسهل بكثير إذا كان لديك نموذج لتظهر، أليس كذلك؟ إذا كان لديك نموذج مع الكوبات أو الورق، يمكنك أن تقول، معلم جي، هذا الصندوق يحتوي على 5 كوبات. أنا أثبت لك ذلك، لأنني بنيته أمامك مباشرة، أليس كذلك؟ إذا كان رسمًا، قد أقول، أنا لا أعرف. أنا لا أستطيع رؤيته، لأنه ليس ثلاثي الأبعاد. الصناديق ثلاثية الأبعاد، أليس كذلك؟,"If you have a model with cups or paper, you can say, Master J, this box contains 5 cups. I proved that to you, because I built it right in front of you, right? If it was a drawing, I might say, I don't know. I can't see it, because it's not three-dimensional."
"Or they could be – like, but they found a formula [inaudible].",student,12,0,,0.0,,أو يمكنهم أن يكونوا مثل ، لكنهم وجدوا صيغة [غير قابلة للسمع].,"Or they could be like, but they found a formula [inaudible]."
"That’s when it would have to be – there you go.  Student M said, she doesn’t want to build it.  She can explain it to me through the formula, right?  And that’s what we’re gonna be looking for, all the different ways that we can prove it.",teacher,47,0,1.0,,0.0,هذه هي المرحلة التي يجب أن تكون فيها هذه هي المرحلة. قال الطالب M أنها لا تريد أن تبني ذلك. يمكنها أن تشرح لي ذلك من خلال الصيغة، أليس كذلك؟ وهذا ما سنبحث عنه، جميع الطرق المختلفة التي يمكننا إثباتها.,"Student M said she doesn't want to adopt it. She can explain it to me through the formula, can't she? That's what we're going to look for, all the different ways we can prove it."
"So, where do you write the [inaudible] that you’re fitting in is –",student,13,0,,0.0,,إذاً، أين تكتب (الجهاز غير السمعي) الذي تتناسب فيه هو,"So, where do you type (non-acoustic device) that fits is ?"
"Your dimensions?  You can put ’em under Number 3 or 4.  If you need a separate piece of paper, grab it.",teacher,21,1,0.0,,0.0,أبعادك؟ يمكنك وضعها تحت الرقم 3 أو 4. إذا كنت بحاجة إلى قطعة ورق منفصلة، أمسك بها.,"You can put it under the number 3 or 4.If you need a separate piece of paper, grab it."
"See all of these are two dimensional drawings, but you’ve only got one [inaudible]. Actually, [inaudible]. I explained it.",student,19,1,,0.0,,انظر كل هذه هي رسومات بعملية اثنين، ولكن لديك واحدة فقط. في الواقع، [غير قابلة للسمع]. شرحت ذلك.,"Look, these are all diagrams of two processes, but you only have one. in fact, [inaudible]. I explained that."
For Number 3?,teacher,3,0,0.0,,0.0,من أجل الرقم 3؟,For the number 3?
"Uh, for 3 and 4.  Yeah.",student,6,0,,,,لثلاثة وأربعة,For three and four
"Okay.  So, make sure you pay attention.  4 is the challenge. Is it working?",teacher,14,0,1.0,,0.0,حسناً، تأكد من الانتباه، الرابع هو التحدي، هل يعمل؟,"Well, be sure to pay attention, the fourth is the challenge, does it work?"
Uh-huh. [Inaudible.],student,2,0,,,,[لا يمكن سماعها],[Unheard of]
"How’s it going, Student D?  You got it better.  Hard to draw, huh?  60 cubes is a lot of cubes.",teacher,20,2,,,0.0,كيف الحال، الطالب (د) ؟ لقد فهمت الأمر بشكل أفضل. من الصعب رسمها، أليس كذلك؟ 60 مكعب هو الكثير من الكعبات.,"How's it going, student D? I understand better. It's hard to draw, isn't it? 60 cubic feet is a lot of heels."
60 is [inaudible] – it’s factors out and when you multiply those things to make 60.,student,16,2,,0.0,,60 هو [غير مسموع]  هو  عوامل خارج وعندما تضرب تلك الأشياء لتصبح 60.,It's [inaudible] 60 is external factors and when you multiply those things to 60.
"Well, what, doll?",teacher,3,0,0.0,,0.0,حسنا، ماذا، دمية؟,"Well, what, a doll?"
And it’s for these.,student,4,0,,,,و هو لهذه.,And this is it.
"Ooh.  I like that.  Mr. K, Student D has almost like a four explanation going on using the word factors.",teacher,20,1,,,0.0,سيد (كاي) ، لدى الطالب (دي) تقريباً أربع تفسيرات مستمرة باستخدام العوامل الكلمة,"Master (K), the student (D) has approximately four continuous interpretations using the word factors."
You shouldn’t be telling everybody [inaudible].,student,6,0,,,,لا يجب أن تخبر الجميع,You don't have to tell everyone.
How we doing?,teacher,3,0,0.0,,0.0,كيف حالنا؟,How are we doing?
Okay.,student,1,0,,,,-حسناً,-Well then
